id,genderId,genderName,categoryId,categoryName,colorId,colorName,name,image
50194,1,Boys,20,Tshirts,2,Black,Gini and Jony Boys Black T-shirt,50194.jpg
40134,1,Boys,14,Shirts,2,Black,Gini and Jony Boys Check Black Shirt,40134.jpg
31103,1,Boys,20,Tshirts,2,Black,Gini and Jony Boys Printed Black T-shirt,31103.jpg
5421,1,Boys,20,Tshirts,27,White,Ant Kids Boy's Love This Game White Kidswear,5421.jpg
36326,1,Boys,20,Tshirts,28,Yellow,Mr. Men Boys Mr. Noisy Yellow T-shirt,36326.jpg
40160,1,Boys,9,Jeans,15,Navy Blue,Gini and Jony Boys Raw Wash Navy Blue Jeans,40160.jpg
38248,1,Boys,20,Tshirts,14,Multi,Batman Boys Multi Coloured T-shirt,38248.jpg
36319,1,Boys,20,Tshirts,28,Yellow,Mr. Men Boys Tickle Yellow T-shirt,36319.jpg
38283,1,Boys,20,Tshirts,7,Green,Marvel Boys Green T-Shirt,38283.jpg
54907,1,Boys,20,Tshirts,3,Blue,Do u speak green Boys T-shirt,54907.jpg
31104,1,Boys,20,Tshirts,22,Red,Gini and Jony Boys Pack of 2 T-shirts,31104.jpg
8339,1,Boys,20,Tshirts,27,White,Doodle Boy's 77 Juniors League White Black Teen Kidswear,8339.jpg
5426,1,Boys,20,Tshirts,2,Black,Ant Kids Boy's Black Cartoon Pop Kidswear,5426.jpg
36321,1,Boys,20,Tshirts,3,Blue,Mr.Men Boys A Lot Of Work Blue T-shirt,36321.jpg
25504,1,Boys,20,Tshirts,3,Blue,Doodle Kids Boys Soccer Blue T-Shirt,25504.jpg
4190,1,Boys,20,Tshirts,28,Yellow,Disney Kids Boy's Yellow Little Friends Kidswear,4190.jpg
5419,1,Boys,20,Tshirts,2,Black,Ant Kids Boy's Musical Buzz Black Red Kidswear,5419.jpg
38284,1,Boys,20,Tshirts,7,Green,Marvel Boys Green Printed T-shirt,38284.jpg
40151,1,Boys,20,Tshirts,27,White,Gini and Jony Boys United White T-shirt,40151.jpg
34024,1,Boys,20,Tshirts,27,White,Gini and Jony Boys Printed White T-shirt,34024.jpg
36317,1,Boys,20,Tshirts,28,Yellow,Mr.Men Boys Blazing Yellow T-shirt,36317.jpg
24873,1,Boys,20,Tshirts,27,White,United Colors of Benetton Kids Boys White Striped T-shirt,24873.jpg
40952,1,Boys,20,Tshirts,22,Red,Gini and Jony Boys Wild West Red T-shirt,40952.jpg
38246,1,Boys,20,Tshirts,7,Green,Batman Boys Green Printed T-shirt,38246.jpg
8330,1,Boys,20,Tshirts,27,White,Doodle Boy's Car Print White Green Blue Kidswear,8330.jpg
4199,1,Boys,20,Tshirts,28,Yellow,Disney Kids Boy's Yellow Royal Sailing Kidswear,4199.jpg
38884,1,Boys,20,Tshirts,22,Red,Allen Solly Kids Boys Flock Print Red T-shirt,38884.jpg
36310,1,Boys,20,Tshirts,28,Yellow,Mr.Men Boys Blazing Yellow T-shirt,36310.jpg
34023,1,Boys,20,Tshirts,7,Green,Palm Tree Boys Printed Green T-shirt,34023.jpg
8337,1,Boys,20,Tshirts,22,Red,Doodle Boy's 77 Juniors League Red White Teen Kidswear,8337.jpg
40955,1,Boys,20,Tshirts,22,Red,Gini and Jony Boys Rodeo Red T-shirt,40955.jpg
24874,1,Boys,20,Tshirts,12,Maroon,United Colors of Benetton Kids Boys Maroon Striped T-shirt,24874.jpg
17807,1,Boys,20,Tshirts,23,Rust,Chhota Bheem Kids Boys Yeh Dosthi Rust Tshirt,17807.jpg
8354,1,Boys,20,Tshirts,4,Brown,Doodle Boy's I am Handsome No1 Rust Kidswear,8354.jpg
38480,1,Boys,20,Tshirts,22,Red,Gini and Jony Boys United Red T-shirt,38480.jpg
40135,1,Boys,20,Tshirts,27,White,Gini and Jony Boys Aviator White T-shirt,40135.jpg
43582,1,Boys,14,Shirts,27,White,Gini and Jony Boys White Check Shirt,43582.jpg
50195,1,Boys,20,Tshirts,2,Black,Gini and Jony Boys Black T-shirt,50195.jpg
36717,1,Boys,20,Tshirts,28,Yellow,Gini and Jony Boys Printed Yellow T-Shirt,36717.jpg
34040,1,Boys,14,Shirts,22,Red,Gini and Jony Boys Check Red Shirt,34040.jpg
31156,1,Boys,20,Tshirts,3,Blue,Gini and Jony Boys Blue T-shirt,31156.jpg
35996,1,Boys,20,Tshirts,28,Yellow,Ben 10 Boys Crew Yellow T-shirt,35996.jpg
8353,1,Boys,20,Tshirts,27,White,Doodle Boy's Original Royal Classic White Kidswear,8353.jpg
31151,1,Boys,20,Tshirts,3,Blue,Gini and Jony Boys Printed Blue T-shirt,31151.jpg
39758,1,Boys,15,Shorts,4,Brown,Gini Jony Boys Brown Shorts,39758.jpg
33262,1,Boys,20,Tshirts,27,White,Gini and Jony Boys Printed White T-shirt,33262.jpg
40132,1,Boys,14,Shirts,22,Red,Gini and Jony Boys Authentic Red Shirt,40132.jpg
31158,1,Boys,20,Tshirts,28,Yellow,Gini and Jony Boys Yellow T-shirt,31158.jpg
36719,1,Boys,20,Tshirts,2,Black,Gini and Jony Boys Printed Black T-Shirt,36719.jpg
36726,1,Boys,20,Tshirts,2,Black,Gini and Jony Boys Polo Black T-Shirt,36726.jpg
33254,1,Boys,20,Tshirts,22,Red,Gini and Jony Boys Red T-shirt,33254.jpg
2694,1,Boys,14,Shirts,22,Red,Disney Kids Boy's Red Twofur Layered Kidswear,2694.jpg
3322,1,Boys,20,Tshirts,3,Blue,KKR Boys Fangear Polo Jersey,3322.jpg
37600,1,Boys,20,Tshirts,22,Red,Madagascar3 Boys Red Printed T-Shirt,37600.jpg
39756,1,Boys,15,Shorts,27,White,Gini Jony Boys White Shorts,39756.jpg
34049,1,Boys,14,Shirts,27,White,Gini and Jony Boys White Shirt,34049.jpg
39332,1,Boys,20,Tshirts,27,White,Gini & Jony Boys White T-shirt,39332.jpg
46831,1,Boys,14,Shirts,20,Pink,Gini and Jony Boys Pink Shirt,46831.jpg
2693,1,Boys,14,Shirts,28,Yellow,Disney Kids Boy's Yellow Kidswear,2693.jpg
35998,1,Boys,20,Tshirts,27,White,Ben 10 Boys Crew White T-shirt,35998.jpg
36721,1,Boys,20,Tshirts,15,Navy Blue,Gini and Jony Boys Printed Dark Navy T-Shirt,36721.jpg
33253,1,Boys,20,Tshirts,28,Yellow,Gini and Jony Boys Printed Yellow T-shirt,33253.jpg
5214,1,Boys,20,Tshirts,27,White,Disney Kids Boy's White Mickey Abhoy Red Set of 2 Kidswear,5214.jpg
36311,1,Boys,20,Tshirts,2,Black,Mr.Men Boys Wonderful Black T-shirt,36311.jpg
34022,1,Boys,20,Tshirts,7,Green,Palm Tree Boys Printed Green T-shirt,34022.jpg
40954,1,Boys,20,Tshirts,22,Red,Gini and Jony Boys Rodeo Red T-shirt,40954.jpg
8336,1,Boys,20,Tshirts,22,Red,Doodle Boy's 77 Juniors League Red White Kidswear,8336.jpg
34025,1,Boys,20,Tshirts,27,White,Gini and Jony Boys Printed White T-shirt,34025.jpg
36316,1,Boys,20,Tshirts,27,White,Mr.Men Boys Mr. Messy White T-shirt,36316.jpg
40150,1,Boys,20,Tshirts,,Grey,Gini and Jony Boys Surfs Up Grey T-shirt,40150.jpg
8331,1,Boys,20,Tshirts,27,White,Doodle Boy's Car Print Teen Kidswear,8331.jpg
4198,1,Boys,20,Tshirts,22,Red,Disney Kids Boy's Red Royal Sailing Kidswear,4198.jpg
38247,1,Boys,20,Tshirts,3,Blue,Batman Boys Blue Printed T-shirt,38247.jpg
40953,1,Boys,20,Tshirts,28,Yellow,Gini and Jony Boys Rodeo Yellow T-shirt,40953.jpg
25505,1,Boys,20,Tshirts,27,White,Doodle Kids Boys Soccer White T-Shirt,25505.jpg
8338,1,Boys,20,Tshirts,27,White,Doodle Boy's 77 Juniors League White Black Kidswear,8338.jpg
31105,1,Boys,20,Tshirts,28,Yellow,Gini and Jony Boys Pack of 2 T-shirts,31105.jpg
5427,1,Boys,20,Tshirts,22,Red,Ant Kids Boy's Red Cartoon Pop Kidswear,5427.jpg
36320,1,Boys,20,Tshirts,3,Blue,Mr.Men Boys Oh Dear Blue T-shirt,36320.jpg
4191,1,Boys,20,Tshirts,7,Green,Disney Kids Boy's Green Little Friends Kidswear,4191.jpg
38249,1,Boys,20,Tshirts,22,Red,Ben 10 Boys Red Printed T-shirt,38249.jpg
31102,1,Boys,20,Tshirts,22,Red,Gini and jony Boys Printed Red T-shirt,31102.jpg
5420,1,Boys,20,Tshirts,3,Blue,Ant Kids Boy's Love This Game Blue Kidswear,5420.jpg
34689,1,Boys,14,Shirts,27,White,Allen Solly Kids Boys Oxford White Shirt,34689.jpg
38282,1,Boys,20,Tshirts,22,Red,DC Comics Boys Red T-shirt,38282.jpg
36318,1,Boys,20,Tshirts,22,Red,Mr. Men Boys Mr. Bump Red T-shirt,36318.jpg
34050,1,Boys,14,Shirts,12,Maroon,Gini and Jony Boys Maroon Shirt,34050.jpg
37621,1,Boys,20,Tshirts,28,Yellow,Madagascar3 Boys Yellow Printed T-Shirt,37621.jpg
15571,1,Boys,20,Tshirts,17,Olive,Chhota Bheem Kids Boys Spare Me TShirt,15571.jpg
40125,1,Boys,15,Shorts,2,Black,Gini and Jony Boys Customised Black Shorts,40125.jpg
50718,1,Boys,20,Tshirts,15,Navy Blue,Doodle Boys Navy Blue Printed T-Shirt,50718.jpg
38490,1,Boys,20,Tshirts,27,White,Gini and Jony Boys Pack Of Two White T-shirt,38490.jpg
40926,1,Boys,9,Jeans,3,Blue,Gini and Jony Boys Comics Blue Jeans,40926.jpg
15576,1,Boys,20,Tshirts,17,Olive,Chhota Bheem Kids Boys Double Trouble TShirt,15576.jpg
34057,1,Boys,3,Capris,3,Blue,Gini and Jony Boys Washed Blue 3/4 Length Pants,34057.jpg
38497,1,Boys,20,Tshirts,28,Yellow,Palm Tree Boys Yellow T-shirt,38497.jpg
3332,1,Boys,20,Tshirts,22,Red,RCB Boys Fangear Tee,3332.jpg
4325,1,Boys,20,Tshirts,3,Blue,Tantra Kid's Unisex Stop Turqoise Kidswear,4325.jpg
40928,1,Boys,9,Jeans,3,Blue,Gini and Jony Boys Rodeo Blue Jeans,40928.jpg
5455,1,Boys,20,Tshirts,7,Green,Ant Kids Boy's Musical Buzz Green T-Shirts Kidswear,5455.jpg
31148,1,Boys,20,Tshirts,27,White,Gini and Jony Boys Printed White T-shirt,31148.jpg
30600,1,Boys,20,Tshirts,2,Black,Nike Boys Black & White Reversible T-shirt,30600.jpg
34059,1,Boys,15,Shorts,,Grey,Gini and Jony Boys Grey Shorts,34059.jpg
8326,1,Boys,20,Tshirts,7,Green,Doodle Boy's Stripper Green Kidswear,8326.jpg
41298,1,Boys,14,Shirts,27,White,Gini and Jony Boys Shirt White Shirts,41298.jpg
34032,1,Boys,14,Shirts,7,Green,Gini and Jony Boys Check Green Shirt,34032.jpg
8319,1,Boys,20,Tshirts,22,Red,Doodle Boy's Route 66 Biker Red Kidswear,8319.jpg
4188,1,Boys,20,Tshirts,3,Blue,Disney Kids Boy's Blue Stripes Little Captain Kidswear,4188.jpg
8321,1,Boys,20,Tshirts,3,Blue,Doodle Boy's Route 66 Biker Blue Kidswear,8321.jpg
37220,1,Boys,14,Shirts,27,White,United Colors of Benetton Boys Printed White Shirt,37220.jpg
40140,1,Boys,20,Tshirts,22,Red,Gini and Jony Boys Core Red T-shirt,40140.jpg
40988,1,Boys,20,Tshirts,3,Blue,Gini and Jony Boys Core Blue T-shirt,40988.jpg
34035,1,Boys,14,Shirts,15,Navy Blue,Gini and Jony Boys Check Navy Blue Shirt,34035.jpg
40975,1,Boys,20,Tshirts,7,Green,Gini and Jony Boys United Green T-shirt,40975.jpg
31115,1,Boys,3,Capris,3,Blue,Gini and Jony Boys Washed Blue 3/4 Length Pants,31115.jpg
8328,1,Boys,20,Tshirts,3,Blue,Doodle Boy's Stripper Blue Kidswear,8328.jpg
40986,1,Boys,20,Tshirts,27,White,Gini and Jony Boys United White T-shirt,40986.jpg
5430,1,Boys,14,Shirts,7,Green,Ant Kids Boy's White Check Kidswear,5430.jpg
31112,1,Boys,3,Capris,28,Yellow,Gini and Jony Boys Yellow 3/4 Length Pants,31112.jpg
34058,1,Boys,3,Capris,15,Navy Blue,Gini and Jony Boys Washed Navy Blue 3/4 Length Pants,34058.jpg
50717,1,Boys,20,Tshirts,27,White,Doodle Boys white Printed T-Shirt,50717.jpg
34060,1,Boys,15,Shorts,,Grey,Gini and Jony Boys Grey Shorts,34060.jpg
40929,1,Boys,9,Jeans,3,Blue,Gini and Jony Boys Rodeo Blue Jeans,40929.jpg
31149,1,Boys,20,Tshirts,22,Red,Gini and Jony Boys Printed Red T-shirt,31149.jpg
34056,1,Boys,3,Capris,3,Blue,Gini and Jony Boys Washed Blue 3/4 Length Pants,34056.jpg
39749,1,Boys,15,Shorts,1,Beige,Gini Jony Boys Beige Shorts,39749.jpg
15577,1,Boys,20,Tshirts,3,Blue,Chhota Bheem Kids Boys Warrior Bheem TShirt,15577.jpg
38496,1,Boys,20,Tshirts,27,White,Gini and Jony Boys United White T-shirt,38496.jpg
37620,1,Boys,20,Tshirts,7,Green,Madagascar3 Boys Green Printed T-Shirt,37620.jpg
15570,1,Boys,20,Tshirts,27,White,Chhota Bheem Kids Boys Flying High TShirt,15570.jpg
40124,1,Boys,20,Tshirts,3,Blue,Gini and Jony Boys Wild West Blue T-shirt,40124.jpg
31147,1,Boys,14,Shirts,3,Blue,Gini and Jony Boys Check Blue Shirt,31147.jpg
34051,1,Boys,14,Shirts,12,Maroon,Palm Tree Boys Maroon Shirt,34051.jpg
40927,1,Boys,9,Jeans,3,Blue,Gini and Jony Boys Comics Blue Jeans,40927.jpg
38491,1,Boys,20,Tshirts,27,White,Gini and Jony Boys Core White T-shirt,38491.jpg
39315,1,Boys,20,Tshirts,28,Yellow,Gini and Jony Boys Printed Yellow T-shirt,39315.jpg
40987,1,Boys,20,Tshirts,3,Blue,Gini and Jony Boys Core Blue T-shirt,40987.jpg
4725,1,Boys,20,Tshirts,28,Yellow,Disney Kids Boy's Royal Sailing Yellow Teen Kidswear,4725.jpg
5431,1,Boys,14,Shirts,20,Pink,Ant Kids Boy's Pink Check Kidswear,5431.jpg
31113,1,Boys,3,Capris,15,Navy Blue,Gini and Jony Boys Washed Navy Blue 3/4 Length Pants,31113.jpg
40980,1,Boys,20,Tshirts,28,Yellow,Gini and Jony Boys Core Yellow T-shirt,40980.jpg
40974,1,Boys,20,Tshirts,7,Green,Gini and Jony Boys United Green T-shirt,40974.jpg
31114,1,Boys,3,Capris,3,Blue,Gini and Jony Boys Washed Blue 3/4 Length Pants,31114.jpg
4189,1,Boys,20,Tshirts,22,Red,Disney Kids Boy's Red Stripes Little Captain Kidswear,4189.jpg
8320,1,Boys,20,Tshirts,22,Red,Doodle Boy's Route 66 Biker Red Teen Kidswear,8320.jpg
34034,1,Boys,14,Shirts,15,Navy Blue,Palm Tree Boys Check Navy Blue Shirt,34034.jpg
40141,1,Boys,20,Tshirts,3,Blue,Gini and Jony Boys Core Blue T-shirt,40141.jpg
37221,1,Boys,14,Shirts,17,Olive,United Colors of Benetton Boys Check Olive Shirt,37221.jpg
8327,1,Boys,20,Tshirts,7,Green,Doodle Boy's Stripper Green Teen Kidswear,8327.jpg
34033,1,Boys,14,Shirts,7,Green,Palm Tree Boys Check Green Shirt,34033.jpg
39834,1,Boys,20,Tshirts,28,Yellow,Gini and Jony Boys Striped Yellow T-Shirt,39834.jpg
4205,1,Boys,20,Tshirts,22,Red,Disney Kids Boy's Red Mickey Since 1928 Tee Kidswear,4205.jpg
48259,1,Boys,20,Tshirts,2,Black,The Amazing Spiderman Boys Black T-shirt,48259.jpg
35890,1,Boys,20,Tshirts,15,Navy Blue,Jungle Book Boys Sherekhan Navy Blue T-shirt,35890.jpg
30718,1,Boys,10,Kurta Sets,22,Red,Fabindia Boys Red & Beige Angarakha Dhoti Set,30718.jpg
21838,1,Boys,20,Tshirts,28,Yellow,Chhota Bheem Kids Boys Bheem Expressions Yellow T-shirt,21838.jpg
4202,1,Boys,20,Tshirts,15,Navy Blue,Disney Kids Boy's Navy Crew Sea Life Sialing Kidswear,4202.jpg
30720,1,Boys,11,Kurtas,3,Blue,Fabindia Boys Printed Blue Kurta,30720.jpg
24911,1,Boys,20,Tshirts,,Grey,United Colors of Benetton Kids Boys Grey Printed T-shirt,24911.jpg
43689,1,Boys,20,Tshirts,22,Red,Doodle Boys Printed Red T-shirt,43689.jpg
18181,1,Boys,9,Jeans,3,Blue,Doodle Boys-Boys Washed Blue Jeans,18181.jpg
34179,1,Boys,20,Tshirts,15,Navy Blue,Gini and Jony Boys Navy Blue T-shirt,34179.jpg
23133,1,Boys,20,Tshirts,,Grey,Chhota Bheem Kids Boys Lets Rock Grey T-shirt,23133.jpg
34184,1,Boys,20,Tshirts,28,Yellow,Gini and Jony Boys Yellow T-shirt,34184.jpg
30716,1,Boys,10,Kurta Sets,3,Blue,Fabindia Boys Blue Dhoti Angarakha Set,30716.jpg
37533,1,Boys,7,Innerwear Vests,28,Yellow,Madagascar3 Boys Yellow Innerwear Vest,37533.jpg
31092,1,Boys,14,Shirts,12,Maroon,Gini and Jony Boys Maroon Shirt,31092.jpg
42594,1,Boys,9,Jeans,3,Blue,United Colors of Benetton Boys Blue Slim Fit Jeans,42594.jpg
34170,1,Boys,20,Tshirts,3,Blue,Gini and Jony Boys Printed Blue T-shirt,34170.jpg
48257,1,Boys,20,Tshirts,22,Red,The Amazing Spiderman Boys Red T-shirt,48257.jpg
54896,1,Boys,21,Trousers,17,Olive,Do u speak green Boys Olive Trousers,54896.jpg
34177,1,Boys,20,Tshirts,27,White,Gini and Jony Boys White T-shirt,34177.jpg
4465,1,Boys,20,Tshirts,22,Red,Disney Boy's Marked Red Teen Kidswear,4465.jpg
35435,1,Boys,15,Shorts,3,Blue,Doodle Boys Check Blue Shorts,35435.jpg
37534,1,Boys,7,Innerwear Vests,3,Blue,Madagascar3 Boys Blue Innerwear Vest,37534.jpg
34183,1,Boys,20,Tshirts,7,Green,Gini and Jony Boys Green T-shirt,34183.jpg
23134,1,Boys,20,Tshirts,15,Navy Blue,Chhota Bheem Kids Boys I Like to Paint Navy Blue T-shirt,23134.jpg
39001,1,Boys,20,Tshirts,22,Red,Gini and Jony Boys Core Red T-shirt,39001.jpg
3815,1,Boys,20,Tshirts,18,Orange,Disney Kids Boy's Orange Just Cruising Kidswear,3815.jpg
48250,1,Boys,20,Tshirts,22,Red,The Amazing Spiderman Boys Red T-Shirt,48250.jpg
41987,1,Boys,20,Tshirts,3,Blue,Gini and Jony Boys Core Blue T-shirt,41987.jpg
33306,1,Boys,9,Jeans,,Grey,Gini and Jony Boys Washed Grey Jeans,33306.jpg
37594,1,Boys,20,Tshirts,7,Green,Madagascar 3 Boys Green Printed T-Shirt,37594.jpg
46731,1,Boys,20,Tshirts,22,Red,Gini and Jony Boys Red Printed T-Shirt,46731.jpg
39856,1,Boys,20,Tshirts,2,Black,Gini and Jony Boys Printed Black T-Shirt,39856.jpg
38984,1,Boys,20,Tshirts,22,Red,Gini and Jony Boys Rodeo Red T-shirt,38984.jpg
35461,1,Boys,20,Tshirts,7,Green,Doodle Boys Printed Green T-shirt,35461.jpg
41980,1,Boys,20,Tshirts,27,White,Gini and Jony Boys Rodeo White T-shirt,41980.jpg
38346,1,Boys,20,Tshirts,3,Blue,Superman Boys Blue T-Shirt,38346.jpg
35459,1,Boys,20,Tshirts,20,Pink,Doodle Boys Printed Pink T-shirt,35459.jpg
22628,1,Boys,20,Tshirts,,Grey,Nike Boy Grey T-shirt,22628.jpg
37593,1,Boys,20,Tshirts,28,Yellow,Madagascar3 Boys Yellow Printed T-Shirt,37593.jpg
39858,1,Boys,20,Tshirts,28,Yellow,Gini and Jony Boys Printed Yellow T-Shirt,39858.jpg
33308,1,Boys,9,Jeans,2,Black,Gini and Jony Boys Solid Black Jeans,33308.jpg
38941,1,Boys,15,Shorts,3,Blue,Gini and Jony Boys Blue Shorts,38941.jpg
41989,1,Boys,14,Shirts,3,Blue,Gini and Jony Boys Check Blue Shirt,41989.jpg
52132,1,Boys,20,Tshirts,27,White,Doodle Boys White Striped T-Shirt,52132.jpg
12844,1,Boys,20,Tshirts,14,Multi,Ant Kids Boys Multicoloured Striped T-shirts,12844.jpg
39860,1,Boys,20,Tshirts,7,Green,Gini and Jony Boys Polo Green T-Shirt,39860.jpg
35457,1,Boys,20,Tshirts,,Grey,Doodle Boys Printed Grey T-shirt,35457.jpg
43686,1,Boys,20,Tshirts,27,White,Doodle Boys Printed White T-shirt,43686.jpg
4464,1,Boys,20,Tshirts,22,Red,Disney Boy's Jack Sparrow Fight Red Teen Kidswear,4464.jpg
31094,1,Boys,14,Shirts,22,Red,Gini and Jony Boys Check Red Shirt,31094.jpg
23135,1,Boys,20,Tshirts,7,Green,Chhota Bheem Kids Boys Lets Rock Green T-shirt,23135.jpg
34182,1,Boys,20,Tshirts,7,Green,Gini and Jony Boys Green T-shirt,34182.jpg
34176,1,Boys,20,Tshirts,27,White,Gini and Jony Boys White T-shirt,34176.jpg
3814,1,Boys,20,Tshirts,3,Blue,Disney Kids Boy's Street Crew Blue Kidswear,3814.jpg
48251,1,Boys,20,Tshirts,16,Off White,The Amazing Spiderman Boys Off White T-Shirt,48251.jpg
42595,1,Boys,9,Jeans,,Grey,United Colors of Benetton Boys Grey Slim Fit Jeans,42595.jpg
34171,1,Boys,20,Tshirts,3,Blue,Gini and Jony Boys Printed Blue T-shirt,34171.jpg
30717,1,Boys,10,Kurta Sets,7,Green,Fabindia Boys Green Dhoti Angarakha Sets,30717.jpg
37532,1,Boys,20,Tshirts,3,Blue,Madagascar3 Infant Boys Light Blue T-Shirt,37532.jpg
34185,1,Boys,20,Tshirts,2,Black,Gini and Jony Boys Black T-shirt,34185.jpg
31093,1,Boys,14,Shirts,27,White,Gini and Jony Boys White Shirt,31093.jpg
48256,1,Boys,20,Tshirts,15,Navy Blue,The Amazing Spiderman Boys Navy Blue T-shirt,48256.jpg
3813,1,Boys,20,Tshirts,28,Yellow,Disney Kids Boy's Street Crew Yellow Kidswear,3813.jpg
25035,1,Boys,20,Tshirts,3,Blue,Nike Boys Stripy Crew Blue T-shirt,25035.jpg
34147,1,Boys,15,Shorts,3,Blue,Gini and Jony Boys Blue Denim Shorts,34147.jpg
4203,1,Boys,20,Tshirts,3,Blue,Disney Kids Boy's Blue Regatta Annual Competition Kidswear,4203.jpg
30721,1,Boys,11,Kurtas,7,Green,Fabindia Boys Printed Green Kurta,30721.jpg
35896,1,Boys,20,Tshirts,27,White,Superman Boys Crew White T-shirt,35896.jpg
34178,1,Boys,20,Tshirts,15,Navy Blue,Gini and Jony Boys Navy Blue T-shirt,34178.jpg
18180,1,Boys,9,Jeans,3,Blue,Doodle Boys-Boys Acid Wash Blue Jeans,18180.jpg
24910,1,Boys,20,Tshirts,15,Navy Blue,United Colors of Benetton Kids Boys Navy Blue Printed T-shirt,24910.jpg
4204,1,Boys,20,Tshirts,27,White,Disney Kids Boy's White Regatta Annual Competition Kidswear,4204.jpg
37167,1,Boys,23,Waistcoat,,Grey,United Colors of Benetton Boys Check Grey Waistcoat,37167.jpg
48258,1,Boys,20,Tshirts,2,Black,The Amazing Spiderman Boys Black T-Shirt,48258.jpg
13306,1,Boys,21,Trousers,2,Black,Gini and Jony Kids Solid Black Trousers,13306.jpg
41745,1,Boys,20,Tshirts,27,White,Doodle Boys Printed White T-shirt,41745.jpg
35891,1,Boys,20,Tshirts,28,Yellow,Jungle Book Boys Ponya 11 Yellow T-shirt,35891.jpg
12845,1,Boys,20,Tshirts,12,Maroon,Ant Kids Boys Arrow Maroon Tshirts,12845.jpg
35456,1,Boys,20,Tshirts,,Grey,Doodle Boys Printed Grey T-shirt,35456.jpg
39861,1,Boys,20,Tshirts,7,Green,Gini and Jony Boys Polo Green T-Shirt,39861.jpg
39859,1,Boys,20,Tshirts,28,Yellow,Palm Tree Boys Printed Yellow T-Shirt,39859.jpg
33309,1,Boys,9,Jeans,2,Black,Palm Tree Boys Solid Black Jeans,33309.jpg
38940,1,Boys,15,Shorts,3,Blue,Palm Tree Boys Blue Shorts,38940.jpg
41988,1,Boys,14,Shirts,3,Blue,Gini and Jony Boys Check Blue Shirt,41988.jpg
38347,1,Boys,20,Tshirts,27,White,Superman Boys White Printed T-shirt,38347.jpg
35458,1,Boys,20,Tshirts,20,Pink,Doodle Boys Printed Pink T-shirt,35458.jpg
41981,1,Boys,20,Tshirts,27,White,Gini and Jony Boys Rodeo White T-shirt,41981.jpg
41986,1,Boys,20,Tshirts,15,Navy Blue,Gini and Jony Boys Around The World Navy Blue T-shirt,41986.jpg
35460,1,Boys,20,Tshirts,7,Green,Doodle Boys Printed Green T-shirt,35460.jpg
37595,1,Boys,20,Tshirts,3,Blue,Madagascar3 Boys Printed Blue T-Shirt,37595.jpg
33307,1,Boys,9,Jeans,,Grey,Gini and Jony Boys Washed Grey Jeans,33307.jpg
36211,1,Boys,15,Shorts,3,Blue,Gini Jony Boys Blue Shorts,36211.jpg
39857,1,Boys,20,Tshirts,28,Yellow,Gini And Jony Boys Printed Yellow T-Shirt,39857.jpg
38985,1,Boys,20,Tshirts,22,Red,Gini and Jony Boys Comics Red T-shirt,38985.jpg
37543,1,Boys,20,Tshirts,28,Yellow,Madagascar3 Infant Boys Lemon Yellow T-Shirt,37543.jpg
38953,1,Boys,20,Tshirts,15,Navy Blue,Gini and Jony Boys Pack of 2 T-shirts,38953.jpg
15045,1,Boys,20,Tshirts,2,Black,ADIDAS Kids Boys Printed Black Tshirts,15045.jpg
36001,1,Boys,20,Tshirts,18,Orange,Ben 10 Boys Crew Orange T-shirt,36001.jpg
34100,1,Boys,20,Tshirts,3,Blue,Doodle Boys Printed Blue T-shirt,34100.jpg
52120,1,Boys,20,Tshirts,27,White,Doodle Boys white Printed T-Shirt,52120.jpg
52127,1,Boys,20,Tshirts,28,Yellow,Doodle Boys Yellow Printed T-Shirt,52127.jpg
41968,1,Boys,20,Tshirts,27,White,Gini and Jony Boys United White T-shirt,41968.jpg
38954,1,Boys,20,Tshirts,7,Green,Gini and Jony Boys Printed Green T-shirt,38954.jpg
37544,1,Boys,20,Tshirts,3,Blue,Madagascar3 Infant Boys Light Blue T-Shirt,37544.jpg
41957,1,Boys,20,Tshirts,,Grey,Gini and Jony Boys Surfs Up Grey T-shirt,41957.jpg
36202,1,Boys,15,Shorts,27,White,Gini Jony Boys White Shorts,36202.jpg
2720,1,Boys,21,Trousers,3,Blue,Disney Kids Boy's Mickey Mouse Print Pants,2720.jpg
39844,1,Boys,20,Tshirts,15,Navy Blue,Gini and Jony Boys Printed Dark Navy T-Shirt,39844.jpg
38996,1,Boys,9,Jeans,3,Blue,Gini and Jony Boys Rodeo Blue Jeans,38996.jpg
41961,1,Boys,9,Jeans,15,Navy Blue,Gini and Jony Boys Raw Wash Navy Blue Jeans,41961.jpg
21848,1,Boys,20,Tshirts,27,White,Chhota Bheem Kids Boys Holi Hai White T-shirt,21848.jpg
41959,1,Boys,20,Tshirts,7,Green,Gini and Jony Boys Rugby Green T-shirt,41959.jpg
39843,1,Boys,20,Tshirts,15,Navy Blue,Gini and Jony Boys Printed Dark Navy T-Shirt,39843.jpg
38991,1,Boys,20,Tshirts,27,White,Gini and Jony Boys Rodeo T-shirt,38991.jpg
36205,1,Boys,14,Shirts,27,White,Gini Jony Boys White Shirt,36205.jpg
2727,1,Boys,20,Tshirts,28,Yellow,Disney Kids Boy's Yellow Polo Tshirt,2727.jpg
41992,1,Boys,15,Shorts,2,Black,Gini and Jony Boys Customised Black Shorts,41992.jpg
41966,1,Boys,20,Tshirts,2,Black,Gini and Jony Boys Surfs Up Black T-shirt,41966.jpg
24995,1,Boys,9,Jeans,3,Blue,United Colors of Benetton Boys Boys Blue Washed Jeans,24995.jpg
52129,1,Boys,20,Tshirts,27,White,Doodle Boys white Printed T-Shirt,52129.jpg
4219,1,Boys,20,Tshirts,18,Orange,Disney Kids Boy's Orange Colour Blast Kidswear,4219.jpg
48245,1,Boys,20,Tshirts,2,Black,Avengers Boys Black Printed T-shirt,48245.jpg
43692,1,Boys,20,Tshirts,27,White,Doodle Boys Printed White T-shirt,43692.jpg
37521,1,Boys,15,Shorts,3,Blue,Madagascar3 Infant Boys Light Blue Shorts,37521.jpg
35878,1,Boys,20,Tshirts,21,Purple,Marvel Boys Comics Purple T-shirt,35878.jpg
41303,1,Boys,14,Shirts,15,Navy Blue,Gini and Jony Boys Navy Blue Shirt,41303.jpg
48242,1,Boys,20,Tshirts,8,Grey Melange,Avengers Boys Grey Printed T-shirt,48242.jpg
42778,1,Boys,20,Tshirts,7,Green,Allen Solly Kids Green T-shirt,42778.jpg
3807,1,Boys,20,Tshirts,22,Red,Disney Kids Boy's Red Mickey Ship Kidswear,3807.jpg
41304,1,Boys,14,Shirts,27,White,Gini and Jony Boys White Check Shirt,41304.jpg
34191,1,Boys,20,Tshirts,22,Red,Gini and Jony Boys Printed Red T-shirt,34191.jpg
37526,1,Boys,22,Rompers,28,Yellow,Madagascar3 Infant Girls Lemon Yellow Snapsuit Romper,37526.jpg
38936,1,Boys,15,Shorts,3,Blue,Gini and Jony Boys Blue Shorts,38936.jpg
43695,1,Boys,20,Tshirts,28,Yellow,Doodle Boys Printed Yellow T-shirt,43695.jpg
35882,1,Boys,20,Tshirts,22,Red,Jungle Book Boys Lets Explore Red T-shirt,35882.jpg
35876,1,Boys,20,Tshirts,18,Orange,Marvel Boys Comics Orange T-shirt,35876.jpg
33144,1,Boys,15,Shorts,3,Blue,Gini and Jony Boys Blue Shorts,33144.jpg
38938,1,Boys,15,Shorts,3,Blue,Gini and Jony Boys Blue Shorts,38938.jpg
37528,1,Boys,22,Rompers,27,White,Madagascar3 Infant Boys White Snapsuit Romper,37528.jpg
35885,1,Boys,20,Tshirts,27,White,Jungle Book Boys Yee-Ha! White T-shirt,35885.jpg
3809,1,Boys,20,Tshirts,22,Red,Disney Kids Boy's He Is Behind You Red Kidswear,3809.jpg
4210,1,Boys,20,Tshirts,3,Blue,Disney Kids Boy's Blue Mickey Mouse Kidswear,4210.jpg
37341,1,Boys,20,Tshirts,18,Orange,U.S. Polo Assn. Kids Boys Orange T-shirt,37341.jpg
37173,1,Boys,15,Shorts,22,Red,United Colors of Benetton Boys Knitted shorts,37173.jpg
37187,1,Boys,20,Tshirts,27,White,United Colors of Benetton Boys Printed White T-shirt,37187.jpg
33143,1,Boys,20,Tshirts,15,Navy Blue,Gini and Jony Boys Pack of 2 T-shirts,33143.jpg
41751,1,Boys,20,Tshirts,28,Yellow,Doodle Boys Printed Yellow T-shirt,41751.jpg
41958,1,Boys,20,Tshirts,,Grey,Gini and Jony Boys Surfs Up Grey T-shirt,41958.jpg
41967,1,Boys,20,Tshirts,27,White,Gini and Jony Boys United White T-shirt,41967.jpg
2719,1,Boys,21,Trousers,3,Blue,Disney Kids Boy's Tiger Print Denim Pants,2719.jpg
41993,1,Boys,15,Shorts,2,Black,Gini and Jony Boys Customised Black Shorts,41993.jpg
36203,1,Boys,15,Shorts,1,Beige,Gini Jony Boys Beige Shorts,36203.jpg
41994,1,Boys,15,Shorts,27,White,Gini and Jony Boys Boxer White Shorts,41994.jpg
41960,1,Boys,14,Shirts,22,Red,Gini and Jony Boys Authentic Red Shirt,41960.jpg
38955,1,Boys,20,Tshirts,7,Green,Palm Tree Boys Printed Green T-shirt,38955.jpg
37545,1,Boys,7,Innerwear Vests,28,Yellow,Madagascar3 Boys Yellow Innerwear Vest,37545.jpg
41969,1,Boys,20,Tshirts,22,Red,Gini and Jony Boys Surfs Up Red T-shirt,41969.jpg
36000,1,Boys,20,Tshirts,15,Navy Blue,Ben 10 Boys Navy Blue T-shirt,36000.jpg
52121,1,Boys,20,Tshirts,15,Navy Blue,Doodle Boys Navy Blue Printed T-Shirt,52121.jpg
34101,1,Boys,20,Tshirts,,Grey,Doodle Boys Printed Grey T-shirt,34101.jpg
15044,1,Boys,20,Tshirts,28,Yellow,ADIDAS Kids Boys Printed Yellow Tshirts,15044.jpg
