id,genderId,genderName,categoryId,categoryName,colorId,colorName,name,image
38952,1,Boys,20,Tshirts,15,Navy Blue,Gini and Jony Boys Pack of 2 T-shirts,38952.jpg
38999,1,Boys,14,Shirts,27,White,Gini and Jony Boys Around the World White Shirts,38999.jpg
35884,1,Boys,20,Tshirts,3,Blue,Jungle Book Boys Little help Blue T-shirt,35884.jpg
38939,1,Boys,15,Shorts,3,Blue,Gini and Jony Boys Blue Shorts,38939.jpg
37529,1,Boys,7,Innerwear Vests,28,Yellow,Madagascar3 Boys Yellow Innerwear Vest,37529.jpg
23129,1,Boys,20,Tshirts,28,Yellow,Chhota Bheem Kids Boys Bheem Expressions Yellow T-shirt,23129.jpg
41750,1,Boys,20,Tshirts,7,Green,Doodle Boys Printed Green T-shirt,41750.jpg
33142,1,Boys,20,Tshirts,3,Blue,Gini and Jony Boys Printed Blue T-shirt,33142.jpg
4211,1,Boys,20,Tshirts,3,Blue,Disney Kids Boy's Blue Donald Kidswear,4211.jpg
37516,1,Boys,13,Leggings,27,White,Madagascar3 Infant Boys White Leggings,37516.jpg
37172,1,Boys,15,Shorts,2,Black,United Colors of Benetton Boys Black Shorts,37172.jpg
35877,1,Boys,20,Tshirts,28,Yellow,Marvel Boys Comics Yellow T-shirt,35877.jpg
37378,1,Boys,20,Tshirts,3,Blue,U.S. Polo Assn. Boys Blue Polo T-shirt,37378.jpg
35883,1,Boys,20,Tshirts,28,Yellow,Jungle Book Boys Rumble In The Jungle Yellow T-shirt,35883.jpg
37511,1,Boys,2,Booties,28,Yellow,Madagascar 3 Infant Boys Yellow Booties,37511.jpg
33145,1,Boys,15,Shorts,3,Blue,Gini and Jony Boys Blue Shorts,33145.jpg
48243,1,Boys,20,Tshirts,2,Black,Avengers Boys Black Printed T-shirt,48243.jpg
3806,1,Boys,20,Tshirts,7,Green,Disney Kids Boy's Green Mickey Ship Kidswear,3806.jpg
37188,1,Boys,20,Tshirts,22,Red,United Colors of Benetton Boys Printed Red T-shirt,37188.jpg
37527,1,Boys,22,Rompers,3,Blue,Madagascar3 Infant Boys Light Blue Snapsuit Romper,37527.jpg
34190,1,Boys,20,Tshirts,22,Red,Gini and Jony Boys Printed Red T-shirt,34190.jpg
38937,1,Boys,15,Shorts,3,Blue,Gini and Jony Boys Blue Shorts,38937.jpg
41305,1,Boys,20,Tshirts,22,Red,Gini and Jony Boys Red & Blue Striped Tshirt,41305.jpg
38765,1,Boys,20,Tshirts,7,Green,Gini and Jony Boys Printed Green T-shirt,38765.jpg
48244,1,Boys,20,Tshirts,22,Red,Avengers Boys Red Printed T-shirt,48244.jpg
43693,1,Boys,20,Tshirts,27,White,Doodle Boys Printed White T-shirt,43693.jpg
35879,1,Boys,20,Tshirts,28,Yellow,Marvel Boys Comics Yellow T-shirt,35879.jpg
37520,1,Boys,15,Shorts,28,Yellow,Madagascar3 Infant Boys Lemon Yellow Shorts,37520.jpg
40958,1,Boys,20,Tshirts,27,White,Gini and Jony Boys Unit White T-shirt,40958.jpg
31107,1,Boys,20,Tshirts,7,Green,Gini and Jony Boys Printed Green T-shirt,31107.jpg
36322,1,Boys,20,Tshirts,27,White,Mr.Men Boys Mr. Scatterbrain White T-shirt,36322.jpg
5425,1,Boys,14,Shirts,12,Maroon,Ant Kids Boys's Anytime Maroon White Kidswear,5425.jpg
36746,1,Boys,5,Clothing Set,27,White,Mr.Men Boys Weeee!! White Clothing Set,36746.jpg
31100,1,Boys,14,Shirts,15,Navy Blue,Gini and Jony Boys Check Navy Blue Shirt,31100.jpg
36325,1,Boys,20,Tshirts,27,White,Mr.Men Boys Mr. Happy White T-shirt,36325.jpg
5422,1,Boys,20,Tshirts,,Grey,Ant Kids Boy's Blue Grey Kidswear,5422.jpg
34029,1,Boys,14,Shirts,2,Black,Palm Tree Boys Check Black Shirt,34029.jpg
40960,1,Boys,20,Tshirts,27,White,Gini and Jony Boys Around the World White T-shirt,40960.jpg
36313,1,Boys,20,Tshirts,28,Yellow,Mr.Men Boys Blazing Yellow T-shirt,36313.jpg
34020,1,Boys,20,Tshirts,18,Orange,Gini and Jony Boys Printed Orange T-shirt,34020.jpg
34682,1,Boys,20,Tshirts,27,White,Allen Solly Kids Boys Printed White T-shirt,34682.jpg
40155,1,Boys,15,Shorts,27,White,Gini and Jony Boys Beach White Shorts,40155.jpg
36748,1,Boys,5,Clothing Set,3,Blue,Mr.Men Boys Mr. Small Blue Clothing Set,36748.jpg
8334,1,Boys,20,Tshirts,7,Green,Doodle Boy's Touring Championship Green Black Kidswear,8334.jpg
31109,1,Boys,20,Tshirts,18,Orange,Gini and Jony Boys Printed Orange T-shirt,31109.jpg
40956,1,Boys,20,Tshirts,22,Red,Gini and Jony Boys Comics Red T-shirt,40956.jpg
54932,1,Boys,20,Tshirts,3,Blue,Do u speak green Boys Blue T-shirt,54932.jpg
40152,1,Boys,20,Tshirts,22,Red,Gini and Jony Boys Surfs Up Red T-shirt,40152.jpg
34027,1,Boys,20,Tshirts,27,White,Gini and Jony Boys Printed White T-shirt,34027.jpg
36314,1,Boys,20,Tshirts,27,White,Mr.Men Boys Hmmph White T-shirt,36314.jpg
40951,1,Boys,20,Tshirts,2,Black,Gini and Jony Boys Core Black T-shirt,40951.jpg
8333,1,Boys,20,Tshirts,27,White,Doodle Boy's Car Print White Red Blue Teen Kidswear,8333.jpg
34018,1,Boys,20,Tshirts,2,Black,Gini and Jony Boys Black Printed T-shirt,34018.jpg
40139,1,Boys,20,Tshirts,15,Navy Blue,Gini and JonyBoys Around The World Navy Blue T-shirt,40139.jpg
10649,1,Boys,14,Shirts,27,White,Doodle Boys Grand Prix White Shirt,10649.jpg
39753,1,Boys,21,Trousers,9,Khaki,Gini Jony Boys Khaki Trousers,39753.jpg
22586,1,Boys,20,Tshirts,3,Blue,Nike Kids Boys Blue T-shirt,22586.jpg
38478,1,Boys,14,Shirts,22,Red,Gini and Jony Boys Rodeo Red Shirts,38478.jpg
36724,1,Boys,20,Tshirts,22,Red,Gini and Jony Boys Polo Red T-Shirt,36724.jpg
49843,1,Boys,15,Shorts,9,Khaki,Gini and Jony Boys Khaki Bermuda Shorts,49843.jpg
5447,1,Boys,14,Shirts,2,Black,Ant Kids Boy's Anytime Check Black Shirt Kidswear,5447.jpg
39754,1,Boys,8,Jackets,22,Red,Gini Jony Boys Printed Red Jacket,39754.jpg
46833,1,Boys,20,Tshirts,2,Black,Gini and Jony Boys Black T-shirt,46833.jpg
36723,1,Boys,20,Tshirts,28,Yellow,Gini and Jony Boys Striped Yellow T-Shirt,36723.jpg
5216,1,Boys,20,Tshirts,7,Green,Disney Kids Boys Green T-shirt,5216.jpg
54959,1,Boys,20,Tshirts,3,Blue,Do u speak green Boys Blue T-shirt,54959.jpg
30612,1,Boys,20,Tshirts,22,Red,Nike Boys Printed Red T-shirt,30612.jpg
10671,1,Boys,15,Shorts,7,Green,Doodle Boy Army  Green Shorts,10671.jpg
2691,1,Boys,15,Shorts,3,Blue,Disney Kids Boy's Mickey Blue Denim Kidswear,2691.jpg
8356,1,Boys,20,Tshirts,2,Black,Doodle Boy's End Is Just Begining Black Kidswear,8356.jpg
40934,1,Boys,14,Shirts,27,White,Gini and JonyBoys Around the World White Shirts,40934.jpg
34042,1,Boys,14,Shirts,22,Red,Gini and JonyBoys Check Red Shirt,34042.jpg
41011,1,Boys,20,Tshirts,27,White,Gini and Jony Boys Pack Of Two White T-shirt,41011.jpg
31154,1,Boys,20,Tshirts,27,White,Gini and Jony Boys White T-shirt,31154.jpg
40137,1,Boys,20,Tshirts,,Grey,Gini and Jony Boys Around The World Grey T-shirt,40137.jpg
40933,1,Boys,9,Jeans,3,Blue,Gini and Jony Boys Rodeo Blue Jeans,40933.jpg
54957,1,Boys,20,Tshirts,28,Yellow,Do u speak green Boys Yellow T-shirt,54957.jpg
8351,1,Boys,20,Tshirts,,Grey,Doodle Boy's Original Royal Classic Grey Melange Kidswear,8351.jpg
43587,1,Boys,14,Shirts,15,Navy Blue,Gini and Jony Boys Blue Shirts,43587.jpg
40130,1,Boys,14,Shirts,27,White,Gini and Jony Boys Core White Shirt,40130.jpg
31153,1,Boys,20,Tshirts,2,Black,Gini and Jony Boys Printed Black T-shirt,31153.jpg
33260,1,Boys,14,Shirts,27,White,Gini and Jony Boys Check White Shirt,33260.jpg
34045,1,Boys,14,Shirts,2,Black,Gini and Jony Boys Black Shirt,34045.jpg
34026,1,Boys,20,Tshirts,27,White,Gini and Jony Boys White Printed T-shirt,34026.jpg
5412,1,Boys,15,Shorts,2,Black,Ant Kids Boy's Black Dungree Kidswear,5412.jpg
36315,1,Boys,20,Tshirts,22,Red,Mr.Men Boys Just Looking Red T-shirt,36315.jpg
40153,1,Boys,20,Tshirts,2,Black,Gini and Jony Boys Surfs Up Black T-shirt,40153.jpg
8332,1,Boys,20,Tshirts,27,White,Doodle Boy's Car Print White Red Blue Kidswear,8332.jpg
34019,1,Boys,20,Tshirts,2,Black,Palm Tree Boys Printed Black T-shirt,34019.jpg
40950,1,Boys,20,Tshirts,2,Black,Gini and Jony Boys Core Black T-shirt,40950.jpg
34683,1,Boys,20,Tshirts,22,Red,Allen Solly Kids Boys Red T-shirt,34683.jpg
40154,1,Boys,20,Tshirts,7,Green,Gini and Jony Boys Rugby Green T-shirt,40154.jpg
36312,1,Boys,20,Tshirts,15,Navy Blue,Mr. Men Boys Mr. Rude Navy Blue T-shirt,36312.jpg
34021,1,Boys,20,Tshirts,18,Orange,Gini and Jony Boys Printed Orange T-shirt,34021.jpg
40957,1,Boys,20,Tshirts,3,Blue,Gini and Jony Boys Comics Blue T-shirt,40957.jpg
54933,1,Boys,20,Tshirts,1,Beige,Do u speak green Boys Beige T-shirt,54933.jpg
31108,1,Boys,20,Tshirts,27,White,Palm Tree Boys Printed White T-shirt,31108.jpg
8335,1,Boys,20,Tshirts,7,Green,Doodle Boy's Touring Championship Green Teen Kidswear,8335.jpg
40162,1,Boys,20,Tshirts,28,Yellow,Gini and Jony Boys Printed Yellow T-Shirt,40162.jpg
31101,1,Boys,14,Shirts,2,Black,Gini and Jony Boys Check Black Shirt,31101.jpg
36324,1,Boys,20,Tshirts,27,White,Mr.Men Boys Mr. Happy White T-shirt,36324.jpg
5423,1,Boys,20,Tshirts,3,Blue,Ant Kids Boy's Grey Blue Kidswear,5423.jpg
34028,1,Boys,14,Shirts,2,Black,Gini and Jony Boys Check White & Black Shirt,34028.jpg
31106,1,Boys,20,Tshirts,27,White,Gini and Jony Boys Printed White T-shirt,31106.jpg
36323,1,Boys,20,Tshirts,7,Green,Mr.Men Boys Mr. Funny Green T-shirt,36323.jpg
5424,1,Boys,20,Tshirts,27,White,Ant Kids Boy's Whats Up White Navy Kidswear,5424.jpg
4192,1,Boys,20,Tshirts,7,Green,Disney Kids Boy's Green Naughty Donald Kidswear,4192.jpg
36747,1,Boys,5,Clothing Set,27,White,Mr.Men Boys I Am Sleeping White Clothing Set,36747.jpg
4730,1,Boys,20,Tshirts,3,Blue,Disney Kids Boy's Champs Blue Teen Kidswear,4730.jpg
35995,1,Boys,20,Tshirts,21,Purple,Ben 10 Boys Crew Purple T-shirt,35995.jpg
8350,1,Boys,20,Tshirts,27,White,Doodle Boy's I love Driving White Kidswear,8350.jpg
31152,1,Boys,20,Tshirts,28,Yellow,Gini and Jony Boys Printed Yellow T-shirt,31152.jpg
34044,1,Boys,14,Shirts,2,Black,Gini and Jony Boys Black Shirt,34044.jpg
40131,1,Boys,14,Shirts,27,White,Gini and Jony Boys Customised White Shirt,40131.jpg
8357,1,Boys,20,Tshirts,7,Green,Doodle Boy's End Is Just Begining Green Kidswear,8357.jpg
33259,1,Boys,15,Shorts,3,Blue,Gini & Jony Boys Blue Shorts,33259.jpg
43581,1,Boys,14,Shirts,27,White,Gini and Jony Boys White Shirt,43581.jpg
40136,1,Boys,20,Tshirts,27,White,Gini and Jony Boys Around The World White T-shirt,40136.jpg
34043,1,Boys,14,Shirts,22,Red,Palm Tree Boys Check Red Shirt,34043.jpg
31155,1,Boys,20,Tshirts,15,Navy Blue,Gini and Jony Boys Navy Blue T-shirt,31155.jpg
29157,1,Boys,20,Tshirts,20,Pink,United Colors of Benetton Boys Hopeland Pink T-shirt,29157.jpg
39331,1,Boys,20,Tshirts,27,White,Gini & Jony Boys White T-shirt,39331.jpg
54958,1,Boys,20,Tshirts,7,Green,Do u speak green Boys Green T-shirt,54958.jpg
36722,1,Boys,20,Tshirts,22,Red,Gini and Jony Boys Striped Red T-Shirt,36722.jpg
39336,1,Boys,3,Capris,3,Blue,Gini & Jony Boys Blue Shorts,39336.jpg
39752,1,Boys,21,Trousers,9,Khaki,Gini Jony Boys Khaki Trousers,39752.jpg
40138,1,Boys,20,Tshirts,28,Yellow,Gini and Jony Boys Under The Sun Yellow T-shirt,40138.jpg
36725,1,Boys,20,Tshirts,7,Green,Gini and Jony Boys Polo Green T-Shirt,36725.jpg
31164,1,Boys,9,Jeans,3,Blue,Gini and Jony Boys Blue Jeans,31164.jpg
22587,1,Boys,20,Tshirts,21,Purple,Nike Kids Boys Purple T-shirt,22587.jpg
38479,1,Boys,20,Tshirts,7,Green,Gini and Jony Boys Core Green T-shirt,38479.jpg
42419,2,Girls,19,Tops,27,White,Gini and Jony Girls Knit White Top,42419.jpg
34009,2,Girls,19,Tops,2,Black,Gini and Jony Girls Black Top,34009.jpg
40143,2,Girls,19,Tops,3,Blue,Gini and Jony Girls Pretty Blossom Blue Top,40143.jpg
23623,2,Girls,19,Tops,20,Pink,Doodle Kids Girls Pink I love Shopping Top,23623.jpg
47154,2,Girls,3,Capris,2,Black,Gini and Jony Girls Black Capris,47154.jpg
25520,2,Girls,19,Tops,27,White,Doodle Kids Girls City Chic White Top,25520.jpg
31120,2,Girls,19,Tops,20,Pink,Palm Tree Girls Pink Top,31120.jpg
31118,2,Girls,19,Tops,22,Red,Gini and Jony Girls Red Top,31118.jpg
54923,2,Girls,3,Capris,17,Olive,Do u speak Green Girls Olive 3/4 Pant,54923.jpg
31127,2,Girls,6,Dresses,2,Black,Gini and Jony Girls Black Dress,31127.jpg
47153,2,Girls,3,Capris,20,Pink,Gini and Jony Girls Pink Capris,47153.jpg
40144,2,Girls,19,Tops,20,Pink,Gini and Jony Girls Pretty Blossom Pink Top,40144.jpg
23624,2,Girls,19,Tops,27,White,Doodle Kids Girls White I love Shopping Top,23624.jpg
34693,2,Girls,15,Shorts,20,Pink,Allen Solly Kids Girls Poplin Pink Shorts,34693.jpg
4718,2,Girls,20,Tshirts,28,Yellow,Disney Kids Girl's Summer Fun Fair Yellow Teen Kidswear,4718.jpg
36750,2,Girls,6,Dresses,15,Navy Blue,Little Miss Girls Chatterbox Navy Blue Dress,36750.jpg
34007,2,Girls,19,Tops,20,Pink,Gini and Jony Girls Pink Top,34007.jpg
31129,2,Girls,6,Dresses,13,Magenta,Giny and Jony Girls Printed White & Pink Dress,31129.jpg
4720,2,Girls,20,Tshirts,28,Yellow,Disney Kids Girl's Fun In The Fair Yellow Teen Kidswear,4720.jpg
17612,2,Girls,20,Tshirts,,Grey,Doodle Cute Girls  Grey Tshirt,17612.jpg
50723,2,Girls,6,Dresses,3,Blue,Doodle Girls Blue Printed Dress,50723.jpg
33271,2,Girls,16,Skirts,22,Red,Gini and Jony Girls Red Skirt,33271.jpg
41007,2,Girls,15,Shorts,15,Navy Blue,Gini and Jony Girls Woven Navy Blue Shorts,41007.jpg
46813,2,Girls,16,Skirts,20,Pink,Gini and Jony Girls Pink Skirt,46813.jpg
41000,2,Girls,15,Shorts,3,Blue,Gini and Jony Girls Woven Blue Shorts,41000.jpg
8378,2,Girls,20,Tshirts,7,Green,Doodle Girl's Princess Lime Kidswear,8378.jpg
39328,2,Girls,15,Shorts,7,Green,Gini and Jony Girls Green Shorts,39328.jpg
50724,2,Girls,6,Dresses,3,Blue,Doodle Girls Blue Washed Dress,50724.jpg
46814,2,Girls,16,Skirts,20,Pink,Gini and Jony Girls Pink Skirt,46814.jpg
29171,2,Girls,16,Skirts,3,Blue,United Colors of Benetton Kids Girls Washed Blue Skirt,29171.jpg
34065,2,Girls,6,Dresses,2,Black,Gini and Jony Girls Black Dress,34065.jpg
31173,2,Girls,19,Tops,27,White,Gini and Jony Girls Printed White Top,31173.jpg
34091,2,Girls,19,Tops,,Grey,Doodle Girls Printed Grey Top,34091.jpg
8371,2,Girls,20,Tshirts,28,Yellow,Doodle Girl's Dont Worry Hippie Yellow Teen Kidswear,8371.jpg
39321,2,Girls,3,Capris,3,Blue,Gini and Jony Girls Blue Capris,39321.jpg
41009,2,Girls,9,Jeans,15,Navy Blue,Gini and Jony Girls Woven Navy Blue Jeans,41009.jpg
8385,2,Girls,20,Tshirts,18,Orange,Doodle Girl's Hippie Chic Orange Teen Kidswear,8385.jpg
37613,2,Girls,20,Tshirts,21,Purple,Madagascar3 Girls Purple Printed T-Shirt,37613.jpg
31180,2,Girls,13,Leggings,27,White,Gini and Jony Kids Leggings,31180.jpg
31174,2,Girls,19,Tops,22,Red,Gini and Jony Girls Red Top,31174.jpg
34062,2,Girls,6,Dresses,20,Pink,Gini and Jony Girls Printed Pink Dress,34062.jpg
40128,2,Girls,19,Tops,18,Orange,Gini and Jony Girls Roseatte Orange Top,40128.jpg
8382,2,Girls,20,Tshirts,3,Blue,Doodle Girl's Raw Edges Light Blue Kidswear,8382.jpg
39326,2,Girls,13,Leggings,2,Black,Gini and Jony Girls Black Leggings,39326.jpg
31128,2,Girls,6,Dresses,3,Blue,Gini and Jony Girls Printed Teal Dress,31128.jpg
31117,2,Girls,19,Tops,27,White,Gini and Jony Girls White Top,31117.jpg
4719,2,Girls,20,Tshirts,27,White,Disney Kids Girl's Fun In The Fair White Teen Kidswear,4719.jpg
38290,2,Girls,19,Tops,26,Turquoise Blue,Kids Ville Girls Turquoise Blue Top,38290.jpg
36751,2,Girls,19,Tops,27,White,Little Miss Girls Blah White Top,36751.jpg
34006,2,Girls,19,Tops,21,Purple,Gini and Jony Girls Purple Top,34006.jpg
40946,2,Girls,19,Tops,15,Navy Blue,Gini and Jony Girls Nautical Blues Navy Blue Top,40946.jpg
31119,2,Girls,19,Tops,21,Purple,Gini and Jony Girls Purple Top,31119.jpg
40145,2,Girls,3,Capris,20,Pink,Gini and Jony Girls Kinky Pink Capris,40145.jpg
23625,2,Girls,19,Tops,20,Pink,Doodle Kids Girls Pink Retro Top,23625.jpg
31126,2,Girls,6,Dresses,27,White,Gini and Jony Girls White Dress,31126.jpg
34008,2,Girls,19,Tops,20,Pink,Gini and Jony Girls Pink Top,34008.jpg
40941,2,Girls,19,Tops,20,Pink,Gini and Jony Girls Pretty Pink Top,40941.jpg
42418,2,Girls,19,Tops,27,White,Gini and Jony Girls Woven White Top,42418.jpg
31121,2,Girls,19,Tops,2,Black,Gini and Jony Girls Black Top,31121.jpg
4717,2,Girls,20,Tshirts,20,Pink,Disney Kids Girl's Summer Fun Fair Pink Teen Kidswear,4717.jpg
31175,2,Girls,19,Tops,13,Magenta,Gini and Jony Girls Purple Top,31175.jpg
34063,2,Girls,6,Dresses,20,Pink,Gini and Jony Girls Printed Pink Dress,34063.jpg
39743,2,Girls,19,Tops,27,White,Gini Jony Girls Printed White Top,39743.jpg
39327,2,Girls,13,Leggings,7,Green,Gini and Jony Girls Green Leggings,39327.jpg
8383,2,Girls,20,Tshirts,3,Blue,Doodle Girl's Raw Edges Light Blue Teen Kidswear,8383.jpg
3901,2,Girls,16,Skirts,3,Blue,Disney Kids Girl's Pooh Denim Blue Skirt,3901.jpg
34064,2,Girls,6,Dresses,3,Blue,Gini and Jony Girls Printed Teal Dress,34064.jpg
31172,2,Girls,19,Tops,19,Peach,Gini and Jony Girls Peach Top,31172.jpg
27225,2,Girls,6,Dresses,20,Pink,Doodle Girls Printed Pink Dress,27225.jpg
8384,2,Girls,20,Tshirts,18,Orange,Doodle Girl's Hippie Chic Orange Kidswear,8384.jpg
41008,2,Girls,9,Jeans,15,Navy Blue,Gini and Jony Girls Woven Navy Blue Jeans,41008.jpg
39744,2,Girls,19,Tops,27,White,Gini Jony Girls Printed White Top,39744.jpg
43590,2,Girls,20,Tshirts,3,Blue,Gini and Jony Girls Polo Striped Blue T-shirt,43590.jpg
40127,2,Girls,6,Dresses,2,Black,Gini and Jony Girls Roseatte Black Dress,40127.jpg
8379,2,Girls,20,Tshirts,7,Green,Doodle Girl's Princess Lime Green Top,8379.jpg
39329,2,Girls,15,Shorts,7,Green,Gini and Jony Girls Green Shorts,39329.jpg
41001,2,Girls,15,Shorts,3,Blue,Gini and Jony  Girls Woven Blue Shorts,41001.jpg
46815,2,Girls,19,Tops,28,Yellow,Gini and Jony Girls Yellow Top,46815.jpg
33270,2,Girls,16,Skirts,27,White,Gini & Jony Girls White Skirt,33270.jpg
50722,2,Girls,6,Dresses,20,Pink,Doodle Girls Pink Printed Dress,50722.jpg
41006,2,Girls,15,Shorts,15,Navy Blue,Gini and Jony Girls Woven Navy Blue Shorts,41006.jpg
8465,2,Girls,20,Tshirts,21,Purple,Doodle Girls's Princess Purple Teen Top,8465.jpg
34118,2,Girls,15,Shorts,2,Black,Doodle Girls Washed Black Shorts,34118.jpg
37564,2,Girls,7,Innerwear Vests,20,Pink,Madagascar3 Pink Girls Innerwear Vest,37564.jpg
12849,2,Girls,6,Dresses,27,White,Ant Kids Girls Butterfly Print White Dresses,12849.jpg
39852,2,Girls,19,Tops,3,Blue,Gini and Jony Girls Printed Blue Top,39852.jpg
37590,2,Girls,7,Innerwear Vests,20,Pink,Madagascar Girls Pink Innerwear Vest,37590.jpg
38342,2,Girls,19,Tops,27,White,Mr. Men Little Miss Girls White Top,38342.jpg
36213,2,Girls,19,Tops,7,Green,Gini And Jony Girls Striped Green Top,36213.jpg
37563,2,Girls,22,Rompers,27,White,Madagascar3 Infant Boys White Snapsuit Romper,37563.jpg
24941,2,Girls,19,Tops,20,Pink,United Colors of Benetton Kids Girls Pink Top,24941.jpg
2707,2,Girls,6,Dresses,20,Pink,Disney Kids Girl's Dress Pink Pooh Kidswear,2707.jpg
34116,2,Girls,3,Capris,3,Blue,Doodle Girls Washed Blue Capris,34116.jpg
38945,2,Girls,19,Tops,27,White,Gini and Jony Girls Printed White Top,38945.jpg
21868,2,Girls,19,Tops,20,Pink,Chhota Bheem Kids Girls Are You Game Pink Top,21868.jpg
24946,2,Girls,19,Tops,27,White,United Colors of Benetton Kids Girls White Printed Top,24946.jpg
27196,2,Girls,6,Dresses,28,Yellow,Doodle Girls Yellow Dress,27196.jpg
34111,2,Girls,19,Tops,15,Navy Blue,Doodle Girls Striped Navy Blue Top,34111.jpg
52131,2,Girls,6,Dresses,3,Blue,Doodle Girls Blue Printed Dress,52131.jpg
2700,2,Girls,19,Tops,27,White,Disney Kids Girl's White Kidswear,2700.jpg
33152,2,Girls,19,Tops,7,Green,Gini and Jony Girls Printed Green Top,33152.jpg
39830,2,Girls,15,Shorts,21,Purple,Gini and Jony Girls Core Purple Shorts,39830.jpg
38327,2,Girls,19,Tops,3,Blue,Hannah Montana Girls Blue Top,38327.jpg
3820,2,Girls,19,Tops,27,White,Disney Kids Girl's Minnie Summer Time White Top,3820.jpg
18171,2,Girls,19,Tops,7,Green,Doodle Kids Girls Ballon Green Top,18171.jpg
42590,2,Girls,20,Tshirts,27,White,United Colors of Benetton Girls White Printed T-Shirt,42590.jpg
38329,2,Girls,19,Tops,16,Off White,Hannah Montana Girls Off White Tops,38329.jpg
35436,2,Girls,15,Shorts,3,Blue,Doodle Girls Washed Blue Shorts,35436.jpg
18178,2,Girls,19,Tops,2,Black,Doodle Kids Girls Black Layer Top,18178.jpg
43683,2,Girls,19,Tops,3,Blue,Doodle Girls Printed Blue Top,43683.jpg
41312,2,Girls,3,Capris,20,Pink,Gini and Jony Girls Fixed Weast Pink Capris,41312.jpg
39005,2,Girls,19,Tops,15,Navy Blue,Gini and Jony Girls Nautical Blues Navy Blue Top,39005.jpg
24947,2,Girls,19,Tops,22,Red,United Colors of Benetton Kids Girls Red Printed Top,24947.jpg
52130,2,Girls,6,Dresses,3,Blue,Doodle Girls Blue Printed Dress,52130.jpg
34110,2,Girls,19,Tops,22,Red,Doodle Girls Printed Red Top,34110.jpg
43042,2,Girls,19,Tops,20,Pink,Gini and Jony Girls Pink Top,43042.jpg
2701,2,Girls,19,Tops,28,Yellow,Disney Kids Girl's Yellow Daisy Kidswear,2701.jpg
38944,2,Girls,19,Tops,27,White,Gini and Jony Girls Printed White Top,38944.jpg
2706,2,Girls,19,Tops,20,Pink,Disney Kids Girl's Pink Pooh Kidswear,2706.jpg
34117,2,Girls,15,Shorts,3,Blue,Doodle Girls Washed Blue Shorts,34117.jpg
38343,2,Girls,19,Tops,27,White,Mr. Men Little Miss Girls White Tops,38343.jpg
41971,2,Girls,19,Tops,3,Blue,Gini and Jony Girls Summer Up Blue Top,41971.jpg
37562,2,Girls,22,Rompers,7,Green,Madagascar3 Infant Boys Light Green Snapsuit Romper,37562.jpg
46733,2,Girls,3,Capris,15,Navy Blue,Gini and Jony Girls Navy Blue Capris,46733.jpg
2730,2,Girls,19,Tops,22,Red,Disney Kids Girl's Red Round Neck Kidswear,2730.jpg
36212,2,Girls,19,Tops,2,Black,Gini Jony Girls Black Top,36212.jpg
24985,2,Girls,19,Tops,20,Pink,United Colors of Benetton Kids Girls Pink Printed Top,24985.jpg
41976,2,Girls,3,Capris,27,White,Gini and Jony Girls White Pedal Pusher,41976.jpg
2708,2,Girls,6,Dresses,27,White,Disney Kids Girl's White Dress Pooh Kidswear,2708.jpg
2737,2,Girls,19,Tops,22,Red,Disney Kids Girl's Red Kidswear,2737.jpg
36215,2,Girls,15,Shorts,21,Purple,Gini and Jony Girls Core Purple Shorts,36215.jpg
37565,2,Girls,7,Innerwear Vests,7,Green,Madagascar Girls Green Innerwear Vest,37565.jpg
38328,2,Girls,19,Tops,20,Pink,Hannah Montana Girls Pink Top,38328.jpg
35437,2,Girls,15,Shorts,2,Black,Doodle Girls Washed Black Shorts,35437.jpg
18179,2,Girls,19,Tops,2,Black,Doodle Kids Girls Black Layer Top,18179.jpg
30725,2,Girls,12,Lehenga Choli,20,Pink,Fabindia Girls Printed Pink Lehenga Choli,30725.jpg
39836,2,Girls,19,Tops,19,Peach,Gini and Jony Girls Printed Peach Top,39836.jpg
33153,2,Girls,19,Tops,27,White,Gini and Jony Girls Printed White Top,33153.jpg
39831,2,Girls,15,Shorts,13,Magenta,Gini and Jony Girls Core Magenta Shorts,39831.jpg
5570,2,Girls,6,Dresses,,Grey,Ant Kids Girl's Sleeveless With Flower Print Kidswear,5570.jpg
3819,2,Girls,20,Tshirts,20,Pink,Disney Kids Girl's Minnie Summer Time Pink Top,3819.jpg
38326,2,Girls,19,Tops,20,Pink,Hannah Montana Girls Pink Printed Top,38326.jpg
34159,2,Girls,19,Tops,27,White,Gini and Jony Girls Printed White Top,34159.jpg
39010,2,Girls,19,Tops,20,Pink,Gini and Jony Girls Kitch Peachy Pink Top,39010.jpg
41307,2,Girls,19,Tops,2,Black,Gini and Jony Girls Black Top,41307.jpg
34166,2,Girls,19,Tops,13,Magenta,Gini and Jony Girls Purple Top,34166.jpg
38935,2,Girls,13,Leggings,2,Black,Gini and Jony Girls Black Leggings,38935.jpg
38767,2,Girls,15,Shorts,20,Pink,Gini and Jony Girls Pink Shorts,38767.jpg
33149,2,Girls,13,Leggings,20,Pink,Gini and Jony Girls Pink Leggings,33149.jpg
38932,2,Girls,13,Leggings,20,Pink,Gini and Jony Girls Pink Leggings,38932.jpg
43691,2,Girls,19,Tops,28,Yellow,Doodle Girls Printed Yellow Top,43691.jpg
34161,2,Girls,19,Tops,2,Black,Gini and Jony Girls Black Top,34161.jpg
41300,2,Girls,20,Tshirts,7,Green,Gini and Jony Girls Polo Striped Blue T-shirt,41300.jpg
38335,2,Girls,19,Tops,22,Red,Mr. Men Little Miss Girls Red Printed Top,38335.jpg
8415,2,Girls,20,Tshirts,27,White,Doodle Girl's Hippie Chic White Teen Kidswear,8415.jpg
41309,2,Girls,19,Tops,19,Peach,Gini and Jony Girls Woven Peach Top,41309.jpg
30731,2,Girls,17,Salwar,13,Magenta,Fabindia Girls Printed Magenta Salwar,30731.jpg
4213,2,Girls,20,Tshirts,20,Pink,Disney Kids Girl's Pink Summer Fun Fair Kidswear,4213.jpg
34157,2,Girls,19,Tops,19,Peach,Gini and Jony Girls Peach Top,34157.jpg
45568,2,Girls,19,Tops,27,White,Gini and Jony Girls Knit White Top,45568.jpg
38332,2,Girls,19,Tops,20,Pink,Hannah Montana Girls Pink Top,38332.jpg
33147,2,Girls,9,Jeans,3,Blue,Gini and Jony Girls Blue Jeans,33147.jpg
41755,2,Girls,19,Tops,3,Blue,Doodle Girls Printed Blue Top,41755.jpg
2741,2,Girls,19,Tops,20,Pink,Disney Kids Girl's Pink Kidswear,2741.jpg
4214,2,Girls,20,Tshirts,28,Yellow,Disney Kids Girl's Yellow Summer Fun Fair Kidswear,4214.jpg
38769,2,Girls,20,Tshirts,3,Blue,Gini and Jony Girls Printed Blue T-shirt,38769.jpg
52124,2,Girls,6,Dresses,18,Orange,Doodle Girls Orange Printed Dress,52124.jpg
2715,2,Girls,19,Tops,18,Orange,Disney Kids Girl's Minnie Orange Stripped Kidswear,2715.jpg
35446,2,Girls,19,Tops,19,Peach,Doodle Girls Printed Peach Top,35446.jpg
3892,2,Girls,20,Tshirts,20,Pink,Disney Kids Girl's Pink Minnie Top With Green Bow Kidswear,3892.jpg
35441,2,Girls,19,Tops,19,Peach,Doodle Girls Printed Peach Top,35441.jpg
41998,2,Girls,19,Tops,3,Blue,Gini and Jony Girls Pretty Blossom Blue Top,41998.jpg
38950,2,Girls,19,Tops,27,White,Palm Tree Girls White Top,38950.jpg
2712,2,Girls,6,Dresses,3,Blue,Disney Kids Girl's Halter Neck Blue Kidswear,2712.jpg
52123,2,Girls,6,Dresses,20,Pink,Doodle Girls Pink Printed Dress,52123.jpg
3895,2,Girls,20,Tshirts,27,White,Disney Kids Girl's White Minnie With Pink Lace Kidswear,3895.jpg
39849,2,Girls,19,Tops,3,Blue,Gini and Jony Girls Striped Blue Top,39849.jpg
37576,2,Girls,2,Booties,27,White,Madagascar 3 Infant Girls White Booties,37576.jpg
37582,2,Girls,15,Shorts,27,White,Madagascar3 Girls White Shorts,37582.jpg
38501,2,Girls,9,Jeans,15,Navy Blue,Gini and Jony Woven Navy Blue Jeans,38501.jpg
37549,2,Girls,2,Booties,20,Pink,Madagascar 3 Infants Girls Pink Booties,37549.jpg
35448,2,Girls,19,Tops,22,Red,Doodle Girls Printed Red Top,35448.jpg
39847,2,Girls,19,Tops,20,Pink,Gini and Jony Girls Printed Pink Top,39847.jpg
37585,2,Girls,22,Rompers,27,White,Madagascar3 Infant Girls White Snapsuit Romper,37585.jpg
37571,2,Girls,19,Tops,7,Green,Madagascar3 Infant Girls Light Green Spaghetti Top,37571.jpg
41996,2,Girls,6,Dresses,2,Black,Gini and Jony Girls Roseatte Black Dress,41996.jpg
38506,2,Girls,3,Capris,20,Pink,Gini and Jony Girls Woven Pink Pedal Pusher,38506.jpg
