id,genderId,genderName,categoryId,categoryName,colorId,colorName,name,image
4729,1,Boys,20,Tshirts,7,Green,Disney Kids Boy's Crew Sea Life Sialing Green Teen Kidswear,4729.jpg
8322,1,Boys,20,Tshirts,3,Blue,Doodle Boy's Route 66 Biker Blue Teen Kidswear,8322.jpg
34036,1,Boys,14,Shirts,3,Blue,Palm Tree Boys Check Blue Shirt,34036.jpg
8325,1,Boys,20,Tshirts,28,Yellow,Doodle Boy's Athletic 77 Dept Yellow Teen Kidswear,8325.jpg
40947,1,Boys,20,Tshirts,22,Red,Gini and Jony Boys Core Red T-shirt,40947.jpg
34031,1,Boys,14,Shirts,3,Blue,Gini and Jony Boys Check Blue Shirt,34031.jpg
40978,1,Boys,20,Tshirts,22,Red,Gini and Jony Boys United Red T-shirt,40978.jpg
34038,1,Boys,14,Shirts,22,Red,Gini and Jony Boys Check Red Shirt,34038.jpg
40985,1,Boys,20,Tshirts,27,White,Gini and Jony Boys United White T-shirt,40985.jpg
31111,1,Boys,9,Jeans,2,Black,Gini and Jony Boys Solid Black Jeans,31111.jpg
10054,1,Boys,20,Tshirts,3,Blue,Reebok Kids Kkr Boy's Premium Blue Jerseys,10054.jpg
17615,1,Boys,20,Tshirts,27,White,Doodle Boys living Upto White Tshirt,17615.jpg
4727,1,Boys,20,Tshirts,3,Blue,Disney Kids Boy's Regatta Annual Blue Teen Kidswear,4727.jpg
40982,1,Boys,20,Tshirts,27,White,Gini and Jony Boys Core White T-shirt,40982.jpg
40949,1,Boys,20,Tshirts,27,White,Gini and Jony Boys Around the World White T-shirt,40949.jpg
25516,1,Boys,20,Tshirts,22,Red,Doodle Kids Boys Airfeild Red T-Shirt,25516.jpg
31116,1,Boys,15,Shorts,,Grey,Gini and Jony Boys Grey Shorts,31116.jpg
15575,1,Boys,20,Tshirts,28,Yellow,Chhota Bheem Kids Boys Best Friends Group TShirt,15575.jpg
37625,1,Boys,20,Tshirts,27,White,Madagascar3 Boys White Printed T-Shirt,37625.jpg
34054,1,Boys,3,Capris,3,Blue,Palm Tree Boys Washed Blue 3/4 Length Pants,34054.jpg
40922,1,Boys,8,Jackets,3,Blue,Gini and Jony Boys Rodeo Blue Jacket,40922.jpg
29176,1,Boys,15,Shorts,9,Khaki,United Colors of Benetton Boys Khaki Shorts,29176.jpg
8340,1,Boys,20,Tshirts,2,Black,Doodle Boy's Volleyball Champion Black White Kidswear,8340.jpg
38494,1,Boys,20,Tshirts,7,Green,Gini and Jony Boys United Green T-shirt,38494.jpg
34053,1,Boys,3,Capris,28,Yellow,Gini and Jony Boys Yellow 3/4 Length Pants,34053.jpg
34261,1,Boys,20,Tshirts,22,Red,Gini and Jony Boys Printed Red T-shirt,34261.jpg
15572,1,Boys,20,Tshirts,18,Orange,Chhota Bheem Kids Boys Warrior Bheem TShirt,15572.jpg
37622,1,Boys,20,Tshirts,22,Red,Madagascar3 Boys Red Printed T-Shirt,37622.jpg
40126,1,Boys,15,Shorts,27,White,Gini and Jony Boys Boxer White Shorts,40126.jpg
38493,1,Boys,20,Tshirts,3,Blue,Gini and Jony Boys Core Blue T-shirt,38493.jpg
39317,1,Boys,20,Tshirts,27,White,Gini and Jony Boys Printed White T-shirt,39317.jpg
40925,1,Boys,9,Jeans,3,Blue,Gini and Jony Boys Comics Blue Jeans,40925.jpg
36199,1,Boys,20,Tshirts,2,Black,Gini Jony Boys Polo Black T-Shirt,36199.jpg
34098,1,Boys,14,Shirts,14,Multi,Doodle Boys Check Multi Coloured Shirt,34098.jpg
30603,1,Boys,15,Shorts,12,Maroon,Nike Boys Basketball Red Shorts,30603.jpg
39745,1,Boys,15,Shorts,3,Blue,Gini Jony Boys Blue Shorts,39745.jpg
34096,1,Boys,20,Tshirts,22,Red,Doodle Boys Printed Red T-shirt,34096.jpg
39319,1,Boys,15,Shorts,1,Beige,Gini and Jony Boys Beige Shorts,39319.jpg
8349,1,Boys,20,Tshirts,7,Green,Doodle Boy's I love Driving Green Kidswear,8349.jpg
50715,1,Boys,20,Tshirts,27,White,Doodle Boys White Printed T-Shirt,50715.jpg
33278,1,Boys,9,Jeans,3,Blue,Gini and Jony Boys Washed Blue Jeans,33278.jpg
40983,1,Boys,20,Tshirts,27,White,Gini and Jony Boys United White T-shirt,40983.jpg
40977,1,Boys,20,Tshirts,7,Green,Gini and Jony Boys Core Green T-shirt,40977.jpg
17613,1,Boys,20,Tshirts,22,Red,Doodle Boys Catch Me Red Tshirt,17613.jpg
40948,1,Boys,20,Tshirts,27,White,Gini and Jony Boys Rodeo T-shirt,40948.jpg
4721,1,Boys,20,Tshirts,22,Red,Disney Kids Boy's Royal Sailing Red Teen Kidswear,4721.jpg
34039,1,Boys,14,Shirts,22,Red,Palm Tree Boys Check Red Shirt,34039.jpg
40984,1,Boys,20,Tshirts,27,White,Gini and Jony Boys United White T-shirt,40984.jpg
4726,1,Boys,20,Tshirts,27,White,Disney Kids Boy's Regatta Annual White Teen Kidswear,4726.jpg
17614,1,Boys,20,Tshirts,2,Black,Doodle Boys Cycle Black Tshirt,17614.jpg
31110,1,Boys,9,Jeans,,Grey,Gini and Jony Boys Washed Grey Jeans,31110.jpg
8324,1,Boys,20,Tshirts,27,White,Doodle Boy's Athletic 77 Dept White Kidswear,8324.jpg
40979,1,Boys,20,Tshirts,28,Yellow,Gini and Jony Boys Core Yellow T-shirt,40979.jpg
34030,1,Boys,14,Shirts,3,Blue,Gini and Jony Boys Check Blue Shirt,34030.jpg
8323,1,Boys,20,Tshirts,27,White,Doodle Boy's Athletic 77 Dept White Kidswear,8323.jpg
4728,1,Boys,20,Tshirts,15,Navy Blue,Disney Kids Boy's Crew Sea Life Sialing Navy Teen Kidswear,4728.jpg
34037,1,Boys,14,Shirts,3,Blue,Palm Tree Boys Check Blue Shirt,34037.jpg
37222,1,Boys,14,Shirts,15,Navy Blue,United Colors of Benetton Boys Check Navy Blue Shirt,37222.jpg
40142,1,Boys,20,Tshirts,7,Green,Gini and Jony Boys Core Green T-shirt,40142.jpg
39318,1,Boys,20,Tshirts,22,Red,Gini and Jony Boys Red T-shirt,39318.jpg
8348,1,Boys,20,Tshirts,4,Brown,Doodle Boy's Little Monsters Rocking Rust Kidswear,8348.jpg
50714,1,Boys,20,Tshirts,27,White,Doodle Boys white Printed T-Shirt,50714.jpg
34097,1,Boys,20,Tshirts,7,Green,Doodle Boys Printed Green T-shirt,34097.jpg
40129,1,Boys,14,Shirts,15,Navy Blue,Gini and Jony BoysCore Navy Blue Shirt,40129.jpg
30602,1,Boys,15,Shorts,2,Black,Nike Boys Basketball Black Shorts,30602.jpg
50713,1,Boys,20,Tshirts,28,Yellow,Doodle Boys Yellow Printed T-Shirt,50713.jpg
39320,1,Boys,15,Shorts,15,Navy Blue,Gini and Jony Boys Navy Blue Shorts,39320.jpg
33283,1,Boys,9,Jeans,2,Black,Gini and Jony Boys Black Jeans,33283.jpg
15573,1,Boys,20,Tshirts,27,White,Chhota Bheem Kids Boys Main Hoon Bheem TShirt,15573.jpg
37623,1,Boys,20,Tshirts,3,Blue,Madagascar 3 Boys Blue Printed T-shirt,37623.jpg
31144,1,Boys,20,Tshirts,20,Pink,Gini and Jony Boys Printed Pink T-shirt,31144.jpg
21580,1,Boys,20,Tshirts,3,Blue,Chhota Bheem Kids-Boys Printed Pale Blue Tshirt,21580.jpg
34260,1,Boys,20,Tshirts,22,Red,Gini and Jony Boys Printed Red T-shirt,34260.jpg
34052,1,Boys,3,Capris,28,Yellow,Gini and Jony Boys Yellow 3/4 Length Pants,34052.jpg
33277,1,Boys,9,Jeans,3,Blue,Gini and Jony Boys Washed Blue Jeans,33277.jpg
40924,1,Boys,9,Jeans,3,Blue,Gini and Jony Boys Jeans Blue Jeans,40924.jpg
34099,1,Boys,20,Tshirts,27,White,Doodle Boys Printed White T-shirt,34099.jpg
38492,1,Boys,20,Tshirts,28,Yellow,Gini and Jony Boys Core Yellow T-shirt,38492.jpg
39316,1,Boys,20,Tshirts,27,White,Gini and Jony Boys Printed White T-shirt,39316.jpg
34055,1,Boys,3,Capris,3,Blue,Palm Tree Boys Washed Blue 3/4 Length Pants,34055.jpg
31143,1,Boys,20,Tshirts,7,Green,Gini and Jony Boys Printed Green T-shirt,31143.jpg
41234,1,Boys,15,Shorts,2,Black,Gini and Jony Boys Black Shorts,41234.jpg
15574,1,Boys,20,Tshirts,21,Purple,Chhota Bheem Kids Boys Best Friends Group TShirt,15574.jpg
37624,1,Boys,20,Tshirts,15,Navy Blue,Madagascar3 Boys Navy Blue T-Shirt,37624.jpg
8341,1,Boys,20,Tshirts,7,Green,Doodle Boy's Volleyball Champion Green White Kidswear,8341.jpg
29177,1,Boys,15,Shorts,3,Blue,United Colors of Benetton Boys Blue Shorts,29177.jpg
40923,1,Boys,9,Jeans,3,Blue,Gini and Jony Boys Jeans Blue Jeans,40923.jpg
38345,1,Boys,20,Tshirts,16,Off White,Superman Boys Off White & Navy Blue T-shirt,38345.jpg
41983,1,Boys,20,Tshirts,27,White,Gini and Jony Boys Around The World White T-shirt,41983.jpg
41977,1,Boys,15,Shorts,27,White,Gini and Jony Boys Beach White Shorts,41977.jpg
33302,1,Boys,20,Tshirts,22,Red,Palm Tree Boys Pack of 2 T-shirts,33302.jpg
41970,1,Boys,20,Tshirts,22,Red,Gini and Jony Boys Surfs Up Red T-shirt,41970.jpg
41984,1,Boys,20,Tshirts,27,White,Gini and Jony Boys Around The World White T-shirt,41984.jpg
37597,1,Boys,20,Tshirts,27,White,Madagascar3 Boys White Printed T-Shirt,37597.jpg
46732,1,Boys,15,Shorts,9,Khaki,Gini and Jony Boys Khaki Bermuda Shorts,46732.jpg
33305,1,Boys,20,Tshirts,28,Yellow,Gini and Jony Boys Pack of 2 T-shirts,33305.jpg
38987,1,Boys,20,Tshirts,7,Green,Gini and Jony Boys Wild West T-shirt,38987.jpg
39855,1,Boys,20,Tshirts,2,Black,Gini and Jony Boys Printed Black T-Shirt,39855.jpg
32647,1,Boys,20,Tshirts,3,Blue,Nike Kids Boys Contemporary Athlete Blue T-shirt,32647.jpg
48238,1,Boys,20,Tshirts,27,White,Avengers Boys White Printed T-shirt,48238.jpg
2738,1,Boys,20,Tshirts,27,White,Disney Kids Boy's Double Fun Kidswear,2738.jpg
12847,1,Boys,20,Tshirts,2,Black,Ant Kids Boys National Champion Black Tshirts,12847.jpg
39863,1,Boys,20,Tshirts,2,Black,Gini and Jony Boys Polo Black T-Shirt,39863.jpg
41979,1,Boys,20,Tshirts,,Grey,Gini and Jony Boys Around The World Grey T-shirt,41979.jpg
35454,1,Boys,20,Tshirts,3,Blue,Doodle Boys Printed Blue T-shirt,35454.jpg
12840,1,Boys,20,Tshirts,4,Brown,Ant Kids Brown Striped T-Shirt,12840.jpg
38989,1,Boys,20,Tshirts,28,Yellow,Gini and Jony Boys Rodeo Yellow T-shirt,38989.jpg
37599,1,Boys,20,Tshirts,28,Yellow,Madagascar3 Boys Yellow Printed T-Shirt,37599.jpg
33139,1,Boys,20,Tshirts,,Grey,Gini and Jony Boys Printed Grey T-shirt,33139.jpg
38942,1,Boys,14,Shirts,27,White,Gini and Jony Boys Check White Shirt,38942.jpg
35453,1,Boys,20,Tshirts,27,White,Doodle Boys Printed White T-shirt,35453.jpg
39864,1,Boys,20,Tshirts,22,Red,Gini and Jony Boys Polo Red T-Shirt,39864.jpg
4201,1,Boys,20,Tshirts,7,Green,Disney Kids Boy's Green Crew Sea Life Sialing Kidswear,4201.jpg
3818,1,Boys,20,Tshirts,7,Green,Disney Kids Boy's Green Pooh Tiger Kidswear,3818.jpg
30723,1,Boys,11,Kurtas,3,Blue,Fabindia Boys Printed Blue Kurta,30723.jpg
18176,1,Boys,18,Sweatshirts,7,Green,Doodle Kids-Boys Flap 02 Green Sweatshirt,18176.jpg
24912,1,Boys,20,Tshirts,28,Yellow,United Colors of Benetton Kids Boys Yellow Printed T-shirt,24912.jpg
37539,1,Boys,2,Booties,27,White,Madagascar 3 Infants Boys White Booties,37539.jpg
35438,1,Boys,14,Shirts,14,Multi,Doodle Boys Check Multi Coloured Shirt,35438.jpg
31098,1,Boys,14,Shirts,22,Red,Gini and Jony Boys Check Red Shirt,31098.jpg
35894,1,Boys,20,Tshirts,7,Green,Jungle Book Boys Bagheera Green T-shirt,35894.jpg
58460,1,Boys,20,Tshirts,27,White,Madagascar 3 Boys White T-shirt,58460.jpg
39837,1,Boys,20,Tshirts,22,Red,Palm Tree Boys Striped Red T-Shirt,39837.jpg
41747,1,Boys,20,Tshirts,7,Green,Doodle Boys Green T-shirt,41747.jpg
58458,1,Boys,20,Tshirts,22,Red,Madagascar 3 Boys Red T-shirt,58458.jpg
4206,1,Boys,20,Tshirts,22,Red,Disney Kids Boy's Red Mickeys Scrap Book Kidswear,4206.jpg
30724,1,Boys,11,Kurtas,27,White,Fabindia Boys Printed White Kurta,30724.jpg
35893,1,Boys,20,Tshirts,27,White,Jungle Book Boys Safari White T-shirt,35893.jpg
34189,1,Boys,20,Tshirts,27,White,Gini and Jony Boys Printed White T-shirt,34189.jpg
34174,1,Boys,20,Tshirts,2,Black,Gini and Jony Boys Printed Black T-shirt,34174.jpg
31096,1,Boys,14,Shirts,7,Green,Palm Tree Boys Check Green Shirt,31096.jpg
34180,1,Boys,20,Tshirts,3,Blue,Gini and Jony Boys Blue T-shirt,34180.jpg
37537,1,Boys,2,Booties,28,Yellow,Madagascar 3 Infant Boys Yellow Booties,37537.jpg
39002,1,Boys,20,Tshirts,2,Black,Gini and Jony Boys Core Black T-shirt,39002.jpg
3816,1,Boys,20,Tshirts,3,Blue,Disney Kids Boy's Blue Just Cruising Kidswear,3816.jpg
48253,1,Boys,20,Tshirts,27,White,The Amazing Spiderman Boys White T-shirt,48253.jpg
30715,1,Boys,10,Kurta Sets,3,Blue,Fabindia Boys Blue & Green Angarakha Dhoti Set,30715.jpg
23130,1,Boys,20,Tshirts,7,Green,Chhota Bheem Kids Boys Lost Alien Green T-shirt,23130.jpg
34187,1,Boys,20,Tshirts,20,Pink,Gini and Jony Boys Printed Pink T-shirt,34187.jpg
31091,1,Boys,14,Shirts,27,White,Gini and Jony Boys White Shirt,31091.jpg
34173,1,Boys,20,Tshirts,28,Yellow,Gini and Jony Boys Printed Yellow T-shirt,34173.jpg
48254,1,Boys,20,Tshirts,18,Orange,The Amazing Spiderman Boys Orange T-shirt,48254.jpg
4208,1,Boys,20,Tshirts,22,Red,Disney Kids Boy's Red Geo Team Kidswear,4208.jpg
3811,1,Boys,20,Tshirts,22,Red,Disney Kids Boy's Pooh And Tiger Red Kidswear,3811.jpg
39839,1,Boys,20,Tshirts,2,Black,Gini and Jony Boys Printed Black T-Shirt,39839.jpg
38988,1,Boys,20,Tshirts,22,Red,Gini and Jony Boys Wild West Red T-shirt,38988.jpg
33138,1,Boys,14,Shirts,27,White,Palm Tree Boys Check White Shirt,33138.jpg
37598,1,Boys,20,Tshirts,3,Blue,Madagascar3 Boys Blue Printed T-Shirt,37598.jpg
39865,1,Boys,20,Tshirts,22,Red,Gini and Jony Boys Polo Red T-Shirt,39865.jpg
35452,1,Boys,20,Tshirts,27,White,Doodle Boys Printed White T-shirt,35452.jpg
38943,1,Boys,14,Shirts,27,White,Gini and Jony Boys Check White Shirt,38943.jpg
12846,1,Boys,20,Tshirts,,Grey,Ant Kids Boys Rock Grey Tshirts,12846.jpg
24940,1,Boys,20,Tshirts,2,Black,United Colors of Benetton Kids Boys Black Printed T-shirt,24940.jpg
35455,1,Boys,20,Tshirts,3,Blue,Doodle Boys Printed Blue T-shirt,35455.jpg
39862,1,Boys,20,Tshirts,2,Black,Gini and Jony Boys Polo Black T-Shirt,39862.jpg
41985,1,Boys,20,Tshirts,28,Yellow,Gini and Jony Boys Under The SunYellow T-shirt,41985.jpg
48239,1,Boys,20,Tshirts,15,Navy Blue,Avengers Boys Navy Blue Printed T-shirt,48239.jpg
32646,1,Boys,20,Tshirts,7,Green,Nike Kids Boys Contemporary Athlete Green T-shirt,32646.jpg
33304,1,Boys,20,Tshirts,28,Yellow,Gini and Jony Boys Pack of 2 T-shirts,33304.jpg
37596,1,Boys,20,Tshirts,15,Navy Blue,Madagascar3 Boys Navy Blue Printed T-Shirt,37596.jpg
38986,1,Boys,20,Tshirts,3,Blue,Gini and Jony Boys Comics Blue T-shirt,38986.jpg
39854,1,Boys,20,Tshirts,27,White,Gini and Jony Boys Printed White T-Shirt,39854.jpg
41982,1,Boys,20,Tshirts,27,White,Gini and Jony Boys Aviator White T-shirt,41982.jpg
38344,1,Boys,20,Tshirts,22,Red,Superman Boys Red Printed T-shirt,38344.jpg
39853,1,Boys,20,Tshirts,27,White,Gini and Jony Boys Printed White T-Shirt,39853.jpg
33303,1,Boys,20,Tshirts,22,Red,Gini and Jony Boys Pack of 2 T-shirts,33303.jpg
21858,1,Boys,20,Tshirts,15,Navy Blue,Chhota Bheem Kids Boys I Like to Paint Navy Blue T-shirt,21858.jpg
34172,1,Boys,20,Tshirts,28,Yellow,Gini and Jony Boys Printed Yellow T-shirt,34172.jpg
34186,1,Boys,20,Tshirts,7,Green,Gini and Jony Boys Printed Green T-shirt,34186.jpg
23131,1,Boys,20,Tshirts,27,White,Chhota Bheem Kids Boys Holi Hai White T-shirt,23131.jpg
30714,1,Boys,4,Churidar,27,White,Fabindia Boys White Churidar,30714.jpg
37531,1,Boys,20,Tshirts,28,Yellow,Madagascar3 Infant Boys Lemon Yellow T-Shirt,37531.jpg
43682,1,Boys,20,Tshirts,7,Green,Doodle Boys Printed Green T-shirt,43682.jpg
31090,1,Boys,14,Shirts,2,Black,Gini and Jony Boys Black Shirt,31090.jpg
41748,1,Boys,20,Tshirts,7,Green,Doodle Boys Stripes Green T-shirt,41748.jpg
39838,1,Boys,20,Tshirts,2,Black,Gini and Jony Boys Printed Black T-Shirt,39838.jpg
21833,1,Boys,20,Tshirts,,Grey,Chhota Bheem Kids Boys Lets Rock Grey T-shirt,21833.jpg
4209,1,Boys,20,Tshirts,7,Green,Disney Kids Boy's Green Mickey On Skates Kidswear,4209.jpg
3810,1,Boys,20,Tshirts,3,Blue,Disney Kids Boy's Pooh And Tiger Blue Kidswear,3810.jpg
31097,1,Boys,14,Shirts,3,Blue,Gini and Jony Boys Check Blue Shirt,31097.jpg
43685,1,Boys,20,Tshirts,27,White,Doodle Boys Printed White T-shirt,43685.jpg
34181,1,Boys,20,Tshirts,3,Blue,Gini and Jony Boys Blue T-shirt,34181.jpg
34175,1,Boys,20,Tshirts,2,Black,Gini and Jony Boys Printed Black T-shirt,34175.jpg
3817,1,Boys,20,Tshirts,28,Yellow,Disney Kids Boy's Yellow Squirrel Kidswear,3817.jpg
48252,1,Boys,20,Tshirts,28,Yellow,The Amazing Spiderman Boys Yellow T-shirt,48252.jpg
37199,1,Boys,15,Shorts,3,Blue,United Colors of Benetton Boys Check Blue Shorts,37199.jpg
39003,1,Boys,20,Tshirts,27,White,Gini and Jony Boys Unit White T-shirt,39003.jpg
4207,1,Boys,20,Tshirts,3,Blue,Disney Kids Boy's Blue Colourtastic Kidswear,4207.jpg
58459,1,Boys,20,Tshirts,15,Navy Blue,Madagascar 3 Boys Navy Blue T-shirt,58459.jpg
34188,1,Boys,20,Tshirts,27,White,Gini and Jony Boys Printed White T-shirt,34188.jpg
18170,1,Boys,18,Sweatshirts,7,Green,Doodle Kids-Boys Be Born Green Sweatshirt,18170.jpg
24914,1,Boys,20,Tshirts,7,Green,United Colors of Benetton Kids Boys Green Printed T-shirt,24914.jpg
35892,1,Boys,20,Tshirts,27,White,Jungle Book Boys Lucky White T-shirt,35892.jpg
4200,1,Boys,20,Tshirts,3,Blue,Disney Kids Boy's Blue Champs Kidswear,4200.jpg
30722,1,Boys,11,Kurtas,12,Maroon,Fabindia Boys Printed Maroon Kurta,30722.jpg
35895,1,Boys,5,Clothing Set,3,Blue,Jungle Book Boys Baby Blue Clothing Set,35895.jpg
24913,1,Boys,20,Tshirts,22,Red,United Colors of Benetton Kids Boys Red Printed T-shirt,24913.jpg
37538,1,Boys,2,Booties,3,Blue,Madagascar 3 Infant Boys Blue Booties,37538.jpg
31099,1,Boys,14,Shirts,3,Blue,Gini and Jony Boys Check Blue Shirt,31099.jpg
35439,1,Boys,14,Shirts,2,Black,Doodle Boys Check Black Shirt,35439.jpg
48241,1,Boys,20,Tshirts,5,Cream,Avengers Boys Cream Printed T-shirt,48241.jpg
42582,1,Boys,23,Waistcoat,27,White,United Colors of Benetton Boys White Waistcoat,42582.jpg
35888,1,Boys,5,Clothing Set,22,Red,Jungle Book Boys Baby Red Clothing Set,35888.jpg
37525,1,Boys,22,Rompers,27,White,Madagascar3 Infant Boys White Snapsuit Romper,37525.jpg
43696,1,Boys,20,Tshirts,28,Yellow,Doodle Boys Printed Yellow T-shirt,43696.jpg
48246,1,Boys,20,Tshirts,27,White,Avengers Boys White T-shirt,48246.jpg
37522,1,Boys,15,Shorts,27,White,Madagascar3 Infant Boys White Shorts,37522.jpg
24909,1,Boys,20,Tshirts,22,Red,United Colors of Benetton Kids Boys Red Printed T-shirt,24909.jpg
43698,1,Boys,20,Tshirts,28,Yellow,Doodle Boys Printed Yellow T-shirt,43698.jpg
35886,1,Boys,20,Tshirts,27,White,Jungle Book Boys 11 White T-shirt,35886.jpg
34168,1,Boys,20,Tshirts,15,Navy Blue,Gini and Jony Boys Printed Navy Blue T-shirt,34168.jpg
37514,1,Boys,13,Leggings,28,Yellow,Madagascar3 Infant Boys Lemon Yellow Leggings,37514.jpg
37342,1,Boys,20,Tshirts,3,Blue,U.S. Polo Assn. Kids Boys Blue T-shirt,37342.jpg
2746,1,Boys,20,Tshirts,28,Yellow,Disney Kids Boy's Yellow Polo Tshirt,2746.jpg
41752,1,Boys,20,Tshirts,28,Yellow,Doodle Boys Printed Yellow T-shirt,41752.jpg
33140,1,Boys,20,Tshirts,15,Navy Blue,Gini and Jony Boys Printed Navy Blue T-shirt,33140.jpg
35881,1,Boys,20,Tshirts,3,Blue,Jungle Book Boys Jungle Friends Blue T-shirt,35881.jpg
35875,1,Boys,20,Tshirts,3,Blue,Marvel Boys Comics Blue T-shirt,35875.jpg
24907,1,Boys,20,Tshirts,15,Navy Blue,United Colors of Benetton Kids Boys Navy Blue Printed T-shirt,24907.jpg
37345,1,Boys,20,Tshirts,3,Blue,U.S. Polo Assn Boys Blue T-Shirt,37345.jpg
48248,1,Boys,20,Tshirts,2,Black,The Amazing Spiderman Boys Black T-shirt,48248.jpg
37513,1,Boys,2,Booties,27,White,Madagascar 3 Infant Boys White Booties,37513.jpg
34104,1,Boys,14,Shirts,2,Black,Doodle Boys Check Black Shirt,34104.jpg
22637,1,Boys,20,Tshirts,2,Black,Nike Kids Boys Printed Black T-shirt,22637.jpg
38957,1,Boys,20,Tshirts,3,Blue,Gini and Jony Boys Printed Blue T-shirt,38957.jpg
37547,1,Boys,20,Tshirts,28,Yellow,Madagascar 3 Infants Boys Yellow Tshirt,37547.jpg
36208,1,Boys,8,Jackets,2,Black,Gini Jony Boys Black Jacket,36208.jpg
15046,1,Boys,18,Sweatshirts,22,Red,ADIDAS Kids Boys Solid Red Sweatshirts,15046.jpg
36002,1,Boys,20,Tshirts,3,Blue,Ben 10 Boys Crew Navy Blue and Green T-shirt,36002.jpg
34103,1,Boys,20,Tshirts,7,Green,Doodle Boys Printed Green T-shirt,34103.jpg
36206,1,Boys,14,Shirts,2,Black,Gini Jony Boys Black Shirt,36206.jpg
2724,1,Boys,20,Tshirts,27,White,Disney Kids Boy's White Red Kidswear,2724.jpg
38992,1,Boys,8,Jackets,3,Blue,Gini and Jony Boys Rodeo Blue Jacket,38992.jpg
39840,1,Boys,20,Tshirts,28,Yellow,Gini and Jony Boys Printed Yellow T-Shirt,39840.jpg
38959,1,Boys,20,Tshirts,15,Navy Blue,Gini and Jony Boys Printed Navy Blue T-shirt,38959.jpg
41991,1,Boys,14,Shirts,2,Black,Gini and Jony Boys Check Black Shirt,41991.jpg
41965,1,Boys,20,Tshirts,2,Black,Gini and Jony Boys Surfs Up Black T-shirt,41965.jpg
38995,1,Boys,9,Jeans,3,Blue,Gini and Jony Boys Comics Blue Jeans,38995.jpg
38961,1,Boys,20,Tshirts,,Grey,Gini and Jony Boys Printed Grey T-shirt,38961.jpg
41962,1,Boys,9,Jeans,15,Navy Blue,Gini and Jony Raw Wash Navy Blue Jeans,41962.jpg
21873,1,Boys,20,Tshirts,7,Green,Chhota Bheem Kids Boys Lets Rock Green T-shirt,21873.jpg
24906,1,Boys,20,Tshirts,20,Pink,United Colors of Benetton Kids Boys Pink Printed T-shirt,24906.jpg
35874,1,Boys,20,Tshirts,,Grey,Marvel Boys Comics Grey T-shirt,35874.jpg
35880,1,Boys,20,Tshirts,27,White,Jungle Book Boys Royal White T-shirt,35880.jpg
9952,1,Boys,20,Tshirts,22,Red,Disney Kids Boys Little Captain Pack of 2 Red Green T-shirt,9952.jpg
37344,1,Boys,20,Tshirts,22,Red,U.S. Polo Assn Boys Red T-Shirt,37344.jpg
37512,1,Boys,2,Booties,3,Blue,Madagascar 3 Infant Boys Blue Booties,37512.jpg
41754,1,Boys,20,Tshirts,27,White,Doodle Boys Printed White T-shirt,41754.jpg
33146,1,Boys,15,Shorts,3,Blue,Gini and Jony Boys Blue Shorts,33146.jpg
35887,1,Boys,20,Tshirts,28,Yellow,Jungle Book Boys Mowgali Yellow T-shirt,35887.jpg
35873,1,Boys,20,Tshirts,27,White,Marvel Boys Comics White T-shirt,35873.jpg
33141,1,Boys,20,Tshirts,7,Green,Palm Tree Boys Printed Green T-shirt,33141.jpg
41753,1,Boys,20,Tshirts,22,Red,Doodle Boys Printed Red T-shirt,41753.jpg
37515,1,Boys,13,Leggings,3,Blue,Madagascar3 Infant Boys Blue Leggings,37515.jpg
37343,1,Boys,20,Tshirts,2,Black,U.S. Polo Assn Boys Black T-Shirt,37343.jpg
24937,1,Boys,20,Tshirts,15,Navy Blue,United Colors of Benetton Kids Boys Navy Blue T-shirt,24937.jpg
48247,1,Boys,20,Tshirts,3,Blue,Avengers Boys Blue Printed T-shirt,48247.jpg
43690,1,Boys,20,Tshirts,22,Red,Doodle Boys Printed Red T-shirt,43690.jpg
37523,1,Boys,22,Rompers,28,Yellow,Madagascar3 Infant Boys Lemon Yellow Snapsuit Romper,37523.jpg
24908,1,Boys,20,Tshirts,28,Yellow,United Colors of Benetton Kids Boys Yellow Printed T-shirt,24908.jpg
48240,1,Boys,20,Tshirts,28,Yellow,Avengers Boys Yellow Printed T-shirt,48240.jpg
37524,1,Boys,22,Rompers,3,Blue,Madagascar3 Infant Boys Light Blue Snapsuit Romper,37524.jpg
43697,1,Boys,20,Tshirts,27,White,Doodle Boys Printed White T-shirt,43697.jpg
42583,1,Boys,23,Waistcoat,15,Navy Blue,United Colors of Benetton Boys Navy Blue Waistcoat,42583.jpg
35889,1,Boys,20,Tshirts,28,Yellow,Jungle Book Boys Follow The Tracks Yellow T-shirt,35889.jpg
38960,1,Boys,20,Tshirts,,Grey,Gini and Jony Boys Printed Grey T-shirt,38960.jpg
36200,1,Boys,8,Jackets,22,Red,Gini Jony Boys Printed Red Jacket,36200.jpg
2722,1,Boys,15,Shorts,3,Blue,Disney Kids Boy's Denim Mickey Surf Kidswear,2722.jpg
38994,1,Boys,9,Jeans,3,Blue,Gini and Jony Boys Jeans Blue Jeans,38994.jpg
31446,1,Boys,20,Tshirts,7,Green,Nike Boys Running Green Jersey,31446.jpg
38993,1,Boys,9,Jeans,3,Blue,Gini and Jony Boys Rodeo Blue Jeans,38993.jpg
22638,1,Boys,20,Tshirts,,Grey,Nike Kids Boys Printed Grey T-shirt,22638.jpg
38958,1,Boys,20,Tshirts,15,Navy Blue,Gini and Jony Boys Printed Navy Blue T-shirt,38958.jpg
41990,1,Boys,14,Shirts,2,Black,Gini and Jony Boys Check Black Shirt,41990.jpg
36003,1,Boys,20,Tshirts,7,Green,Ben 10 Boys Crew Green T-shirt,36003.jpg
34102,1,Boys,20,Tshirts,20,Pink,Doodle Boys Printed Pink T-shirt,34102.jpg
52122,1,Boys,20,Tshirts,27,White,Doodle Boys white Printed T-Shirt,52122.jpg
35440,1,Boys,14,Shirts,2,Black,Doodle Boys Check Black Shirt,35440.jpg
21843,1,Boys,20,Tshirts,7,Green,Chhota Bheem Kids Boys Lost Alien Green T-shirt,21843.jpg
38956,1,Boys,20,Tshirts,3,Blue,Gini and Jony Boys Printed Blue T-shirt,38956.jpg
34105,1,Boys,15,Shorts,3,Blue,Doodle Boys Check Blue Shorts,34105.jpg
2714,1,Boys,20,Tshirts,22,Red,Disney Kids Boy's Red Goofy Surf Kidswear,2714.jpg
13343,1,Boys,15,Shorts,2,Black,Gini and Jony Boys Black Cargo Shorts,13343.jpg
36004,1,Boys,20,Tshirts,28,Yellow,Ben 10 Boys Crew Yellow T-shirt,36004.jpg
36209,1,Boys,8,Jackets,,Grey,Gini Jony Boys Grey Jacket,36209.jpg
31448,1,Boys,15,Shorts,3,Blue,Nike Boys Running Blue Shorts,31448.jpg
34048,1,Boys,14,Shirts,27,White,Gini and Jony Boys White Shirt,34048.jpg
39333,1,Boys,20,Tshirts,27,White,Gini & Jony Boys White T-shirt,39333.jpg
31161,1,Boys,1,Blazers,15,Navy Blue,Gini and Jony Boys Printed Navy Blue Blazer,31161.jpg
35999,1,Boys,20,Tshirts,22,Red,Ben 10 Boys Crew Red T-shirt,35999.jpg
33252,1,Boys,20,Tshirts,27,White,Gini and Jony Boys Printed White T-shirt,33252.jpg
36720,1,Boys,20,Tshirts,2,Black,Palm Tree Boys Printed Black T-Shirt,36720.jpg
3324,1,Boys,20,Tshirts,3,Blue,KKR Boys Fangear Tee,3324.jpg
39334,1,Boys,20,Tshirts,27,White,Gini & Jony Boys White T-shirt,39334.jpg
31159,1,Boys,20,Tshirts,2,Black,Gini and Jony Boys Black T-shirt,31159.jpg
39750,1,Boys,15,Shorts,1,Beige,Gini Jony Boys Beige Shorts,39750.jpg
36718,1,Boys,20,Tshirts,28,Yellow,Gini and Jony Boys Printed Yellow T-Shirt,36718.jpg
2695,1,Boys,20,Tshirts,27,White,Disney Kids Boy's Baby Mickey Surf Kidswear,2695.jpg
37601,1,Boys,20,Tshirts,27,White,Madagascar3 Boys White Printed T-Shirt,37601.jpg
33255,1,Boys,20,Tshirts,7,Green,Gini and Jony Boys Printed Green T-shirt,33255.jpg
31166,1,Boys,15,Shorts,3,Blue,Gini and Jony Boys Washed Blue Denim Shorts,31166.jpg
35997,1,Boys,20,Tshirts,2,Black,Ben 10 Boys Crew Black T-shirt,35997.jpg
40133,1,Boys,14,Shirts,3,Blue,Gini and Jony Boys Check Blue Shirt,40133.jpg
5486,1,Boys,20,Tshirts,15,Navy Blue,Ant Kids Boy's Whats Up Navy Kidswear,5486.jpg
31150,1,Boys,20,Tshirts,15,Navy Blue,Gini and Jony Boys Printed Navy Blue T-shirt,31150.jpg
39759,1,Boys,15,Shorts,4,Brown,Gini Jony Boys Brown Shorts,39759.jpg
33263,1,Boys,20,Tshirts,27,White,Gini & Jony Boys White T-shirt,33263.jpg
34046,1,Boys,14,Shirts,27,White,Gini and Jony Boys White Shirt,34046.jpg
8355,1,Boys,20,Tshirts,28,Yellow,Doodle Boy's I am Handsome No1 Yellow Kidswear,8355.jpg
33264,1,Boys,15,Shorts,1,Beige,Gini and Jony Boys Beige Shorts,33264.jpg
36716,1,Boys,20,Tshirts,27,White,Gini and Jony Boys Printed White T-Shirt,36716.jpg
34041,1,Boys,14,Shirts,22,Red,Gini and Jony Boys Check Red Shirt,34041.jpg
31157,1,Boys,20,Tshirts,7,Green,Gini and Jony Boys Green T-shirt,31157.jpg
41012,1,Boys,20,Tshirts,27,White,Gini and Jony Boys Pack Of Two White T-shirt,41012.jpg
