id,genderId,genderName,categoryId,categoryName,colorId,colorName,name,image
38333,2,Girls,19,Tops,28,Yellow,Hannah Montana Girls Yellow Printed Tops,38333.jpg
38768,2,Girls,20,Tshirts,3,Blue,Gini and Jony Girls Printed Blue T-shirt,38768.jpg
4215,2,Girls,20,Tshirts,27,White,Disney Kids Girl's White Fun In The Fair Kidswear,4215.jpg
2740,2,Girls,19,Tops,3,Blue,Disney Kids Girl's Blue Kidswear,2740.jpg
8414,2,Girls,20,Tshirts,27,White,Doodle Girl's Hippie Chic White Kidswear,8414.jpg
38334,2,Girls,19,Tops,27,White,Mr. Men Little Miss Girls White Printed Top,38334.jpg
34156,2,Girls,19,Tops,19,Peach,Gini and Jony Girls Peach Top,34156.jpg
30730,2,Girls,17,Salwar,21,Purple,Fabindia Girls Printed Purple Salwar,30730.jpg
4212,2,Girls,20,Tshirts,28,Yellow,Disney Kids Girl's Yellow Kidswear,4212.jpg
38905,2,Girls,15,Shorts,20,Pink,Allen Solly Kids Girls Poplin Pink Shorts,38905.jpg
33148,2,Girls,13,Leggings,2,Black,Gini and Jony Girls Black Leggings,33148.jpg
38766,2,Girls,15,Shorts,20,Pink,Gini and Jony Girls Pink Shorts,38766.jpg
41301,2,Girls,20,Tshirts,20,Pink,Gini and Jony Grils Polo Striped Pink T-shirt,41301.jpg
38933,2,Girls,13,Leggings,20,Pink,Gini and Jony Girls Pink Leggings,38933.jpg
16806,2,Girls,15,Shorts,27,White,ANT Kids Girls Solid White Short,16806.jpg
34158,2,Girls,19,Tops,27,White,Gini and Jony Girls Printed White Top,34158.jpg
39011,2,Girls,13,Leggings,3,Blue,Gini and Jony Girls Happy Style Blue Leggings,39011.jpg
38934,2,Girls,13,Leggings,2,Black,Gini and Jony Girls Black Leggings,38934.jpg
34167,2,Girls,6,Dresses,27,White,Gini and Jony Girls White Dress,34167.jpg
37570,2,Girls,19,Tops,20,Pink,Madagascar3 Infant Girls Pink Spaghetti Top,37570.jpg
39846,2,Girls,19,Tops,7,Green,Gini And Jony Girls Striped Green Top,39846.jpg
37584,2,Girls,22,Rompers,7,Green,Madagascar3 Infant Girls Light Green Snapsuit Romper,37584.jpg
41997,2,Girls,19,Tops,3,Blue,Gini and Jony Girls Pretty Blossom Blue Top,41997.jpg
3851,2,Girls,20,Tshirts,20,Pink,Disney Kids Girl's Minnie Heart Pink Kidswear,3851.jpg
41963,2,Girls,19,Tops,7,Green,Gini and Jony Girls Core Green Top,41963.jpg
37583,2,Girls,22,Rompers,20,Pink,Madagascar3 Infant Girls Pink Snapsuit Romper,37583.jpg
39841,2,Girls,19,Tops,20,Pink,Gini and Jony Girls Striped Pink Top,39841.jpg
36207,2,Girls,19,Tops,27,White,Gini Jony Girls Printed White Top,36207.jpg
38500,2,Girls,9,Jeans,2,Black,Gini and Jony Girls Woven Black Jeans,38500.jpg
35449,2,Girls,19,Tops,15,Navy Blue,Doodle Girls Striped Navy Blue Top,35449.jpg
41999,2,Girls,19,Tops,20,Pink,Gini and Jony Girls Pretty Blossom Pink Top,41999.jpg
3894,2,Girls,20,Tshirts,20,Pink,Disney Kids Girl's Pink Minnie With Green Lace Kidswear,3894.jpg
35447,2,Girls,19,Tops,22,Red,Doodle Girls Printed Red Top,35447.jpg
52125,2,Girls,6,Dresses,20,Pink,Doodle Girls Pink Printed Dress,52125.jpg
3893,2,Girls,20,Tshirts,7,Green,Disney Kids Girl's Green Minnie Top With Pink Bow Kidswear,3893.jpg
5215,2,Girls,20,Tshirts,27,White,Disney Kids Girl's Pink White Sweet Hunny Pack of 2 Kidswear,5215.jpg
42003,2,Girls,3,Capris,2,Black,Gini and Jony Girls Elasticated Black Capris,42003.jpg
10672,2,Girls,19,Tops,21,Purple,Doodle Girls Little song board Purple Tops,10672.jpg
43579,2,Girls,19,Tops,27,White,Gini and Jony Girls Woven White Top,43579.jpg
8364,2,Girls,20,Tshirts,3,Blue,Doodle Girl's Happy Smiles Blue Pink Kidswear,8364.jpg
42004,2,Girls,3,Capris,2,Black,Gini and Jony Girls Elasticated Black Capris,42004.jpg
36727,2,Girls,19,Tops,3,Blue,Gini and Jony Girls Printed Blue Top,36727.jpg
5444,2,Girls,19,Tops,2,Black,Ant Kids Girl's Check Top Black Kidswear,5444.jpg
40930,2,Girls,13,Leggings,3,Blue,Gini and Jony Girls Happy Style Blue Leggings,40930.jpg
37608,2,Girls,20,Tshirts,18,Orange,Madagascar3 Girls Coral Printed T-Shirt,37608.jpg
37637,2,Girls,20,Tshirts,25,Teal,Madagascar3 Girls Teal Printed T-Shirt,37637.jpg
43584,2,Girls,19,Tops,20,Pink,Gini and Jony Girls Pink Top,43584.jpg
31168,2,Girls,6,Dresses,27,White,Gini and Jony Girls White Dress,31168.jpg
36729,2,Girls,19,Tops,20,Pink,Gini and Jony Girls Printed Pink Top,36729.jpg
38481,2,Girls,19,Tops,27,White,Gini and Jony Girls Milan White Top,38481.jpg
57980,2,Girls,19,Tops,27,White,Doodle Girls White and Purple Printed Top,57980.jpg
43577,2,Girls,19,Tops,19,Peach,Gini and Jony Girls Woven Peach Top,43577.jpg
37630,2,Girls,20,Tshirts,22,Red,Madagascar3 Girls Soft Red Printed T-Shirt,37630.jpg
34015,2,Girls,6,Dresses,13,Magenta,Gini and Jony Girls Pink Dress,34015.jpg
25503,2,Girls,6,Dresses,2,Black,Doodle Kids Girls Polka Dot Black Dress,25503.jpg
40997,2,Girls,9,Jeans,2,Black,Gini and Jony  Girls Woven Black Jeans,40997.jpg
34012,2,Girls,19,Tops,27,White,Palm Tree Girls Printed White Top,34012.jpg
36745,2,Girls,5,Clothing Set,22,Red,Little Miss Girls Sunshine Red Clothing Set,36745.jpg
40158,2,Girls,19,Tops,3,Blue,Gini and Jony Girls Summer Up Blue Top,40158.jpg
40990,2,Girls,19,Tops,27,White,Palm Tree Girls Milan White Top,40990.jpg
40999,2,Girls,9,Jeans,2,Black,Gini and Jony Girls Woven Black Jeans,40999.jpg
17609,2,Girls,20,Tshirts,27,White,Doodle Girls Raindrops White Tshirts,17609.jpg
5417,2,Girls,20,Tshirts,3,Blue,Ant Kids Girls Blue T-shirt,5417.jpg
40156,2,Girls,19,Tops,7,Green,Gini and Jony Girls Core Green Top,40156.jpg
5428,2,Girls,20,Tshirts,27,White,Ant Kids Girl's White Free Bird Kidswear,5428.jpg
37209,2,Girls,9,Jeans,3,Blue,United Colors of Benetton Girls Blue Jeans,37209.jpg
36728,2,Girls,19,Tops,19,Peach,Gini and Jony Girls Printed Peach Top,36728.jpg
43576,2,Girls,19,Tops,27,White,Gini and Jony Girls Knits White Top,43576.jpg
40931,2,Girls,13,Leggings,3,Blue,Gini and Jony Girls Happy Style Blue Leggings,40931.jpg
37636,2,Girls,20,Tshirts,22,Red,Madagascar3 Girls Soft Red Printed T-Shirt,37636.jpg
43585,2,Girls,19,Tops,20,Pink,Gini and Jony Girls Pink Top,43585.jpg
43578,2,Girls,19,Tops,19,Peach,Gini and Jony Girls Woven Peach Top,43578.jpg
8365,2,Girls,20,Tshirts,20,Pink,Doodle Girl's Happy Smiles Pink Kidswear,8365.jpg
31167,2,Girls,6,Dresses,3,Blue,Gini and Jony Girls Blue Dress,31167.jpg
40938,2,Girls,19,Tops,13,Magenta,Gini and Jony Girls Nautical Blues Magenta Top,40938.jpg
42002,2,Girls,3,Capris,20,Pink,Gini and Jony Girls Kinky Pink Capris,42002.jpg
37607,2,Girls,20,Tshirts,24,Sea Green,Madagascar3 Girls Sea Green Printed T-Shirt,37607.jpg
31160,2,Girls,19,Tops,27,White,Gini and Jony Girls Printed White Top,31160.jpg
5416,2,Girls,20,Tshirts,27,White,Ant Kids Girl's White Little Heart Kidswear,5416.jpg
42290,2,Girls,16,Skirts,20,Pink,Gini and Jony Girls Pink Skirt,42290.jpg
40998,2,Girls,9,Jeans,2,Black,Palm Tree Girls Woven Black Jeans,40998.jpg
34013,2,Girls,19,Tops,27,White,Gini and Jony Girls Printed White Top,34013.jpg
36744,2,Girls,19,Tops,20,Pink,Little Miss Girls Naughty Pink Top,36744.jpg
38285,2,Girls,19,Tops,20,Pink,Kids Ville Girls Pink Printed Top,38285.jpg
5418,2,Girls,20,Tshirts,20,Pink,Ant Kids Girl's Pink Free Bird Kidswear,5418.jpg
40991,2,Girls,19,Tops,28,Yellow,Gini and Jony Girls Milan Yellow Top,40991.jpg
40159,2,Girls,19,Tops,20,Pink,Gini and Jony Girls Pink Top,40159.jpg
37201,2,Girls,9,Jeans,3,Blue,United Colors of Benetton Girls Washed Blue Jeans,37201.jpg
40161,2,Girls,3,Capris,27,White,Gini and Jony Girls White Pedal Pusher,40161.jpg
34014,2,Girls,19,Tops,27,White,Gini and Jony Girls Printed White Top,34014.jpg
36743,2,Girls,19,Tops,20,Pink,Little Miss Girls Chatterbox Pink Top,36743.jpg
40996,2,Girls,3,Capris,20,Pink,Gini and Jony Girls Woven Pink Pedal Pusher,40996.jpg
41003,2,Girls,16,Skirts,3,Blue,Gini and Jony Girls Woven Blue Skirt,41003.jpg
43592,2,Girls,20,Tshirts,20,Pink,Gini and Jony Girls Polo Striped Pink T-shirt,43592.jpg
39314,2,Girls,16,Skirts,22,Red,Gini and Jony Girls Red Skirt,39314.jpg
29172,2,Girls,16,Skirts,20,Pink,United Colors of Benetton Kids Girls Printed Pink Skirt,29172.jpg
37626,2,Girls,20,Tshirts,20,Pink,Madagascar3 Girls Pink Printed T-Shirt,37626.jpg
33272,2,Girls,3,Capris,20,Pink,Gini & Jony Girls Pink Pedal Pusher,33272.jpg
50720,2,Girls,6,Dresses,18,Orange,Doodle Girls Orange Printed Dress,50720.jpg
41004,2,Girls,16,Skirts,15,Navy Blue,Gini and Jony Girls Woven Navy Blue Skirts,41004.jpg
41236,2,Girls,3,Capris,2,Black,Gini and Jony Kids Girls Black Capris,41236.jpg
37610,2,Girls,20,Tshirts,20,Pink,Madagascar3 Girls Pink Printed T-Shirt,37610.jpg
34095,2,Girls,6,Dresses,16,Off White,Doodle Girls Printed Multi Coloured Dress,34095.jpg
31177,2,Girls,19,Tops,22,Red,Gini and Jony Girls Red Top,31177.jpg
34061,2,Girls,6,Dresses,13,Magenta,Gini and Jony Girls Printed White & Pink Dress,34061.jpg
8381,2,Girls,20,Tshirts,21,Purple,Doodle Girl's Raw Edges Purple Teen Kidswear,8381.jpg
3903,2,Girls,20,Tshirts,28,Yellow,Disney Kids Girl's Minnie And Daisy Yellow Kidswear,3903.jpg
8375,2,Girls,20,Tshirts,3,Blue,Doodle Girl's Dont Worry Hippie Blue Teen Kidswear,8375.jpg
39325,2,Girls,19,Tops,28,Yellow,Gini and Jony Girls Printed Yellow Top,39325.jpg
36731,2,Girls,19,Tops,20,Pink,Gini and Jony Girls Striped Pink Top,36731.jpg
34066,2,Girls,6,Dresses,27,White,Palm Tree Girls White Dress,34066.jpg
34092,2,Girls,19,Tops,16,Off White,Doodle Girls Printed Off White Top,34092.jpg
8372,2,Girls,20,Tshirts,3,Blue,Doodle Girl's Dont Worry Hippie Teal Blue Kidswear,8372.jpg
39322,2,Girls,3,Capris,3,Blue,Gini and Jony Girls Blue Capris,39322.jpg
39746,2,Girls,19,Tops,2,Black,Gini Jony Girls Black Top,39746.jpg
37628,2,Girls,20,Tshirts,16,Off White,Madagascar3 Girls Off White Printed T-Shirt,37628.jpg
3904,2,Girls,20,Tshirts,27,White,Disney Kids Girl's Red And White Minnie Flower Kidswear,3904.jpg
40944,2,Girls,19,Tops,20,Pink,Gini and Jony Girls Kitch Bright Pink Top,40944.jpg
31124,2,Girls,6,Dresses,13,Magenta,Gini and Jony Girls Pink Dress,31124.jpg
40147,2,Girls,3,Capris,3,Blue,Gini and Jony Girls Blue Pedal Pusher,40147.jpg
17620,2,Girls,13,Leggings,22,Red,Doodle Girls Red Leggings,17620.jpg
40943,2,Girls,19,Tops,20,Pink,Gini and Jony Girls Kitch Bright Pink Top,40943.jpg
17618,2,Girls,13,Leggings,2,Black,Doodle Girls Lace Bow Black Leggings,17618.jpg
31123,2,Girls,19,Tops,27,White,Gini and Jony Girls Printed White Top,31123.jpg
40149,2,Girls,6,Dresses,20,Pink,Gini and Jony Girls Play Suit Pink Dress,40149.jpg
4723,2,Girls,20,Tshirts,3,Blue,Disney Kids Girl's Jeans Blue Teen Kidswear,4723.jpg
36754,2,Girls,19,Tops,27,White,Little Miss Girls Blazing White Top,36754.jpg
34003,2,Girls,19,Tops,27,White,Gini and Jony Girls White Top,34003.jpg
38868,2,Girls,19,Tops,,Grey,Allen Solly Kids Girls Mock Layered Grey Top,38868.jpg
40972,2,Girls,19,Tops,27,White,Palm Tree Girls Knits White Tops,40972.jpg
4186,2,Girls,20,Tshirts,15,Navy Blue,Disney Kids Girls Navy Stripes Mickey Kidswear,4186.jpg
36753,2,Girls,5,Clothing Set,3,Blue,Little Miss Girls Chatterbox Blue Clothing Set,36753.jpg
34004,2,Girls,19,Tops,27,White,Gini and Jony Girls White Top,34004.jpg
4724,2,Girls,20,Tshirts,28,Yellow,Disney Kids Girl's Yellow Teen Kidswear,4724.jpg
36730,2,Girls,19,Tops,3,Blue,Gini and Jony Girls Striped Blue Top,36730.jpg
37629,2,Girls,20,Tshirts,3,Blue,Madagascar3 Girls Blue Printed T-Shirt,37629.jpg
39323,2,Girls,15,Shorts,3,Blue,Gini and Jony Girls Blue Shorts,39323.jpg
31176,2,Girls,19,Tops,27,White,Gini and Jony Girls White Top,31176.jpg
37611,2,Girls,20,Tshirts,3,Blue,Madagascar3 Girls Blue Printed T-Shirt,37611.jpg
34094,2,Girls,19,Tops,11,Lime Green,Doodle Girls Printed Lime Green Top,34094.jpg
39324,2,Girls,15,Shorts,3,Blue,Gini and Jony Girls Blue Shorts,39324.jpg
8380,2,Girls,19,Tops,21,Purple,Doodle Girls Purple Printed Top,8380.jpg
3902,2,Girls,20,Tshirts,20,Pink,Disney Kids Girl's Minnie And Daisy Pink Kidswear,3902.jpg
50721,2,Girls,6,Dresses,20,Pink,Doodle Girls Pink Printed Dress,50721.jpg
33273,2,Girls,13,Leggings,7,Green,Gini and Jony Girls Green Leggings,33273.jpg
41005,2,Girls,16,Skirts,15,Navy Blue,Gini and Jony Girls Woven Navy Blue Skirts,41005.jpg
37627,2,Girls,20,Tshirts,21,Purple,Madagascar3 Girls Purple Printed T-Shirt,37627.jpg
43593,2,Girls,20,Tshirts,20,Pink,Gini and Jony Girls Polo Striped Pink T-shirt,43593.jpg
41002,2,Girls,16,Skirts,3,Blue,Gini and Jony Girls Woven Blue Skirt,41002.jpg
33274,2,Girls,13,Leggings,2,Black,Gini and Jony Girls Black Leggings,33274.jpg
29173,2,Girls,16,Skirts,7,Green,United Colors of Benetton Kids Girls Printed Green Skirt,29173.jpg
50719,2,Girls,19,Tops,22,Red,Doodle Girls Red Printed Top,50719.jpg
31178,2,Girls,19,Tops,2,Black,Gini and Jony Girls Black Top,31178.jpg
46816,2,Girls,19,Tops,28,Yellow,Gini and Jony Girls Yellow Top,46816.jpg
36752,2,Girls,5,Clothing Set,28,Yellow,Little Miss Girls Blazing Yellow Clothing Set,36752.jpg
4187,2,Girls,20,Tshirts,22,Red,Disney Kids Girls Red Stripes Mickey Kidswear,4187.jpg
34005,2,Girls,19,Tops,21,Purple,Palm Tree Girls Purple Top,34005.jpg
40148,2,Girls,6,Dresses,3,Blue,Gini and Jony Girls Play Suit Blue Dress,40148.jpg
4722,2,Girls,20,Tshirts,21,Purple,Disney Kids Girl's Jeans Purple Teen Kidswear,4722.jpg
17619,2,Girls,13,Leggings,27,White,Doodle Girls Lace Bow White Leggings,17619.jpg
40989,2,Girls,19,Tops,27,White,Gini and Jony Girls Milan White Top,40989.jpg
31122,2,Girls,19,Tops,27,White,Gini and Jony Girls Printed White Top,31122.jpg
23621,2,Girls,6,Dresses,15,Navy Blue,Doodle Kids Girls Navy Blue Floral Print Dress,23621.jpg
40945,2,Girls,19,Tops,15,Navy Blue,Gini and Jony Girls Nautical Blues Navy Blue Top,40945.jpg
41299,2,Girls,19,Tops,20,Pink,Gini and Jony Girls Pink Top,41299.jpg
5438,2,Girls,20,Tshirts,3,Blue,Ant Kids Girl's Humming Birds Blue Kidswear,5438.jpg
17621,2,Girls,13,Leggings,20,Pink,Doodle Girls Lace Bow LT.Pink Leggings,17621.jpg
47151,2,Girls,3,Capris,2,Black,Gini and Jony Kids Girls Black Capris,47151.jpg
40146,2,Girls,3,Capris,2,Black,Gini and Jony Girls Elasticated Black Capris,40146.jpg
31125,2,Girls,19,Tops,19,Peach,Palm Tree Girls Printed Peach Top,31125.jpg
5575,2,Girls,16,Skirts,7,Green,Ant Kids Girl's Green Kidswear,5575.jpg
41744,2,Girls,19,Tops,27,White,Doodle Girls Printed White Top,41744.jpg
24929,2,Girls,6,Dresses,15,Navy Blue,United Colors of Benetton Kids Girls Navy Blue Dress,24929.jpg
30727,2,Girls,17,Salwar,7,Green,Fabindia Girls Green Mangalgiri Salwar,30727.jpg
5581,2,Girls,16,Skirts,20,Pink,Ant Kids Girl's Flower Print Frill Pink Kidswear,5581.jpg
18172,2,Girls,19,Tops,13,Magenta,Doodle Kids Girls Magenta Layer Top,18172.jpg
5586,2,Girls,16,Skirts,4,Brown,Ant Kids Girl's Tiger Print Kidswear,5586.jpg
33151,2,Girls,19,Tops,20,Pink,Gini and Jony Girls Printed Pink Top,33151.jpg
34710,2,Girls,20,Tshirts,7,Green,Allen Solly Kids Girls Polka Green T-shirt,34710.jpg
18175,2,Girls,6,Dresses,10,Lavender,Doodle Kids Girls Party Frock Lavender Dress,18175.jpg
35432,2,Girls,6,Dresses,20,Pink,Doodle Girls Printed Pink Dress,35432.jpg
41311,2,Girls,3,Capris,27,White,Gini and Jony Girls Fixed Weast White Capris,41311.jpg
30729,2,Girls,17,Salwar,3,Blue,Fabindia Girls Printed Blue Salwar,30729.jpg
34721,2,Girls,21,Trousers,2,Black,Allen Solly Kids Girls Twill Black Trousers,34721.jpg
43687,2,Girls,19,Tops,20,Pink,Doodle Girls Pink Top,43687.jpg
34148,2,Girls,16,Skirts,3,Blue,Gini and Jony Girls Washed Blue Skirt,34148.jpg
41973,2,Girls,19,Tops,20,Pink,Gini and Jony Girls Core Pink Top,41973.jpg
2732,2,Girls,19,Tops,27,White,Disney Kids Girl's White Round Neck Kidswear,2732.jpg
37560,2,Girls,15,Shorts,27,White,Madagascar3 Girls White Shorts,37560.jpg
38948,2,Girls,19,Tops,20,Pink,Gini and Jony Girls Printed Pink Top,38948.jpg
37558,2,Girls,15,Shorts,20,Pink,Madagascar3 Girls Pink Shorts,37558.jpg
37567,2,Girls,20,Tshirts,7,Green,Madagascar3 Infant Girls Light Green  T-Shirt,37567.jpg
9927,2,Girls,20,Tshirts,18,Orange,Doodle Girls Saturday 24Am Orange Tshirts,9927.jpg
36217,2,Girls,15,Shorts,20,Pink,Gini Jony Girls Pink Shorts,36217.jpg
39851,2,Girls,19,Tops,3,Blue,Gini and Jony Girls Printed Blue Top,39851.jpg
24945,2,Girls,19,Tops,7,Green,United Colors of Benetton Kids Girls Green Printed Top,24945.jpg
21853,2,Girls,20,Tshirts,18,Orange,Chhota Bheem Kids Girls Sea Princess Light Orange T-shirt,21853.jpg
35450,2,Girls,19,Tops,27,White,Doodle Girls Printed White Top,35450.jpg
37551,2,Girls,2,Booties,27,White,Madagascar 3 Infant Girls White Booties,37551.jpg
34112,2,Girls,19,Tops,27,White,Doodle Girls Printed White Top,34112.jpg
2703,2,Girls,19,Tops,20,Pink,Disney Kids Girl's Check Pink Kidswear,2703.jpg
37569,2,Girls,20,Tshirts,7,Green,Madagascar3 Infant Girls Light Green T-Shirt,37569.jpg
24942,2,Girls,19,Tops,2,Black,United Colors of Benetton Kids Girls Black Top,24942.jpg
2704,2,Girls,6,Dresses,27,White,Disney Kids Girl's White Pooh Kidswear,2704.jpg
34115,2,Girls,6,Dresses,3,Blue,Doodle Girls Printed Blue Dress,34115.jpg
38946,2,Girls,19,Tops,7,Green,Gini and Jony Girls Printed Green Top,38946.jpg
35434,2,Girls,6,Dresses,3,Blue,Doodle Girls Printed Blue Dress,35434.jpg
42592,2,Girls,6,Dresses,20,Pink,United Colors of Benetton Kids Girls Pink Printed Dress,42592.jpg
34149,2,Girls,16,Skirts,3,Blue,Gini and Jony Girls Washed Blue Skirt,34149.jpg
41310,2,Girls,19,Tops,27,White,Gini and Jony Girls Knits White Top,41310.jpg
23132,2,Girls,20,Tshirts,18,Orange,Chhota Bheem Kids Girls Sea Princess Light Orange T-shirt,23132.jpg
35433,2,Girls,6,Dresses,3,Blue,Doodle Girls Printed Blue Dress,35433.jpg
38922,2,Girls,20,Tshirts,7,Green,Allen Solly Kids Girls Polka Green T-shirt,38922.jpg
30728,2,Girls,17,Salwar,18,Orange,Fabindia Girls Orange Mangalgiri Salwar,30728.jpg
18174,2,Girls,6,Dresses,10,Lavender,Doodle Kids Girls Party Frock Lavender Dress,18174.jpg
43688,2,Girls,19,Tops,20,Pink,Doodle Girls Pink Top,43688.jpg
30726,2,Girls,12,Lehenga Choli,3,Blue,Fabindia Girls Printed Blue Lehenga Choli,30726.jpg
39835,2,Girls,19,Tops,19,Peach,Gini and Jony Girls Printed Peach Top,39835.jpg
39009,2,Girls,19,Tops,20,Pink,Gini and Jony Girls Pretty Pink Top,39009.jpg
18173,2,Girls,19,Tops,13,Magenta,Doodle Kids Girls Layer Magenta Top,18173.jpg
37568,2,Girls,20,Tshirts,20,Pink,Madagascar3 Infant Girls Pink  T-Shirt,37568.jpg
24943,2,Girls,20,Tshirts,27,White,United Colors of Benetton Kids Girls White T-shirt,24943.jpg
36218,2,Girls,13,Leggings,20,Pink,Gini Jony Girls Pink Leggings,36218.jpg
38947,2,Girls,19,Tops,7,Green,Gini and Jony Girls Printed Green Top,38947.jpg
2705,2,Girls,6,Dresses,3,Blue,Disney Kids Girl's Blue Pooh Blouse Kidswear,2705.jpg
34114,2,Girls,6,Dresses,3,Blue,Doodle Girls Printed Blue Dress,34114.jpg
24944,2,Girls,19,Tops,22,Red,United Colors of Benetton Kids Girls Red Top,24944.jpg
34113,2,Girls,6,Dresses,20,Pink,Doodle Girls Printed Pink Dress,34113.jpg
43041,2,Girls,19,Tops,20,Pink,Gini and Jony Girls Pink Top,43041.jpg
2702,2,Girls,14,Shirts,3,Blue,Disney Kids Girl's Blue Check Kidswear Shirt,2702.jpg
35451,2,Girls,19,Tops,27,White,Doodle Girls Printed White Top,35451.jpg
37550,2,Girls,2,Booties,7,Green,Madagascar 3 Infant Girls Light Green Booties,37550.jpg
24986,2,Girls,19,Tops,27,White,United Colors of Benetton Kids Girls White Top,24986.jpg
41975,2,Girls,3,Capris,27,White,Gini and Jony Girls White Pedal Pusher,41975.jpg
38949,2,Girls,19,Tops,20,Pink,Gini and Jony Girls Printed Pink Top,38949.jpg
37559,2,Girls,15,Shorts,7,Green,Madagascar3 Girls Green Shorts,37559.jpg
36216,2,Girls,15,Shorts,13,Magenta,Gini and Jony Girls Core Magenta Shorts,36216.jpg
37566,2,Girls,20,Tshirts,20,Pink,Madagascar3 Infant Girls Pink  T-Shirt,37566.jpg
21863,2,Girls,19,Tops,28,Yellow,Chhota Bheem Kids Girls Lets Catch Them Yellow Top,21863.jpg
38340,2,Girls,19,Tops,16,Off White,Mr. Men Little Miss Girls Off White Top,38340.jpg
41972,2,Girls,19,Tops,3,Blue,Gini and Jony Girls Summer Up Blue Top,41972.jpg
37561,2,Girls,22,Rompers,20,Pink,Madagascar3 Infant Girls Pink Snapsuit Romper,37561.jpg
35442,2,Girls,19,Tops,27,White,Doodle Girls Printed White Top,35442.jpg
2711,2,Girls,6,Dresses,20,Pink,Disney Kids Girl's Halter Neck Pink Kidswear,2711.jpg
3896,2,Girls,16,Skirts,3,Blue,Disney Kids Girl's Denim Minnie Dark Blue Skirt,3896.jpg
37588,2,Girls,20,Tshirts,20,Pink,Madagascar3 Infant Girls Pink  T-Shirt,37588.jpg
38998,2,Girls,6,Dresses,20,Pink,Gini and Jony Girls Summer Paradise Pink Dress,38998.jpg
34107,2,Girls,19,Tops,20,Pink,Doodle Girls Pink Top,34107.jpg
13341,2,Girls,3,Capris,21,Purple,Gini and Jony Girls Purple Capris,13341.jpg
2716,2,Girls,19,Tops,22,Red,Disney Kids Girl's Minnie Red Stripped Kidswear,2716.jpg
35445,2,Girls,19,Tops,20,Pink,Doodle Girls Pink Top,35445.jpg
3898,2,Girls,20,Tshirts,20,Pink,Disney Kids Girl's Pink Pooh And Tree Kidswear,3898.jpg
37586,2,Girls,7,Innerwear Vests,20,Pink,Madagascar Girls Pink Innerwear Vest,37586.jpg
24992,2,Girls,15,Shorts,20,Pink,United Colors of Benetton Kids Girls Pink Shorts,24992.jpg
41995,2,Girls,3,Capris,3,Blue,Gini and Jony Girls Blue Pedal Pusher,41995.jpg
38505,2,Girls,16,Skirts,3,Blue,Gini and Jony Girls Woven Blue Skirt,38505.jpg
3853,2,Girls,20,Tshirts,20,Pink,Disney Kids Girl's Pink Daisy and Squirrel Kidswear,3853.jpg
37575,2,Girls,2,Booties,7,Green,Madagascar 3 Infant Girls Light Green Booties,37575.jpg
37581,2,Girls,15,Shorts,7,Green,Madagascar 3 Girls Light Green Shorts,37581.jpg
38502,2,Girls,15,Shorts,15,Navy Blue,Gini and Jony Girls Woven Navy Blue Shorts,38502.jpg
3854,2,Girls,20,Tshirts,20,Pink,Disney Kids Girl's Pink Minnie Sunshine Kidswear,3854.jpg
2718,2,Girls,19,Tops,22,Red,Disney Kids Girl's Red Pooh Kidswear,2718.jpg
34109,2,Girls,19,Tops,3,Blue,Doodle Girls Printed Blue Top,34109.jpg
8420,2,Girls,20,Tshirts,20,Pink,Doodle Girl's Crazy And Funny Pink Kidswear,8420.jpg
16803,2,Girls,15,Shorts,1,Beige,ANT Kids Girls Solid Beige Short,16803.jpg
38931,2,Girls,9,Jeans,3,Blue,Gini and Jony Girls Blue Jeans,38931.jpg
34162,2,Girls,19,Tops,27,White,Gini and Jony Girls White Top,34162.jpg
16804,2,Girls,6,Dresses,27,White,ANT Kids Girls Printed White Dress,16804.jpg
34165,2,Girls,19,Tops,27,White,Gini and Jony Girls Printed White Top,34165.jpg
8418,2,Girls,20,Tshirts,3,Blue,Doodle Girl's Crazy Funny Blue Kidswear,8418.jpg
18169,2,Girls,6,Dresses,20,Pink,Doodle Kids Girls Party Frock Pink Dress,18169.jpg
38331,2,Girls,19,Tops,27,White,Hannah Montana Girls White Top,38331.jpg
41756,2,Girls,19,Tops,20,Pink,Doodle Girls Pink Top,41756.jpg
2742,2,Girls,19,Tops,27,White,Disney Kids Girl's White Minnie & Red Kidswear,2742.jpg
38900,2,Girls,3,Capris,28,Yellow,Allen Solly Kids Girls Poplin Yellow Capris,38900.jpg
4217,2,Girls,20,Tshirts,3,Blue,Disney Kids Girl's Blue Disney Jeans Kidswear,4217.jpg
38336,2,Girls,19,Tops,20,Pink,Mr. Men Little Miss Girls Pink Top,38336.jpg
18167,2,Girls,6,Dresses,13,Magenta,Doodle Kids Girls Party Frock Purple Dress,18167.jpg
38907,2,Girls,20,Tshirts,22,Red,Allen Solly Kids Girls Printed Red T-shirt,38907.jpg
37580,2,Girls,15,Shorts,20,Pink,Madagascar 3 Girls Pink Shorts,37580.jpg
37574,2,Girls,2,Booties,20,Pink,Madagascar 3 Infants Girls Pink Booties,37574.jpg
34108,2,Girls,19,Tops,20,Pink,Doodle Girls Printed Orange Top,34108.jpg
52128,2,Girls,6,Dresses,3,Blue,Doodle Girls Blue Washed Dress,52128.jpg
38503,2,Girls,15,Shorts,3,Blue,Gini and Jony Girls Woven Blue Shorts,38503.jpg
3855,2,Girls,20,Tshirts,22,Red,Disney Kids Girl's Red Pretty as a Flower Kidswear,3855.jpg
39845,2,Girls,19,Tops,7,Green,Gini And Jony Girls Striped Green Top,39845.jpg
38997,2,Girls,6,Dresses,3,Blue,Gini and Jony Girls Digital Blue Dress,38997.jpg
3899,2,Girls,20,Tshirts,27,White,Disney Kids Girl's Pooh And Tree White Kidswear,3899.jpg
37587,2,Girls,7,Innerwear Vests,7,Green,Madagascar3 Girls Green Innerwear Vest,37587.jpg
38504,2,Girls,16,Skirts,15,Navy Blue,Gini and Jony Girls Navy Blue Skirts,38504.jpg
3852,2,Girls,20,Tshirts,20,Pink,Disney Kids Girl's Pink Daisy Kidswear,3852.jpg
24993,2,Girls,15,Shorts,15,Navy Blue,United Colors of Benetton Kids Girls Navy Blue Shorts,24993.jpg
35444,2,Girls,19,Tops,20,Pink,Doodle Girls Pink Top,35444.jpg
34106,2,Girls,19,Tops,27,White,Doodle Girls Printed White Top,34106.jpg
52126,2,Girls,19,Tops,22,Red,Doodle Girls Red Printed Top,52126.jpg
2717,2,Girls,19,Tops,3,Blue,Disney Kids Girls  Kidswear,2717.jpg
2728,2,Girls,19,Tops,20,Pink,Disney Kids Girl's Pink & White Pooh Kidswear,2728.jpg
2710,2,Girls,6,Dresses,27,White,Disney Kids Girl's White Daisy Kidswear,2710.jpg
3897,2,Girls,20,Tshirts,27,White,Disney Kids Girl's Pooh And Hearts White Kidswear,3897.jpg
8417,2,Girls,20,Tshirts,28,Yellow,Doodle Girl's Saturday 24Am Yellow Teen Kidswear,8417.jpg
38337,2,Girls,19,Tops,28,Yellow,Mr. Men Little Miss Girls Yellow Top,38337.jpg
18166,2,Girls,6,Dresses,13,Magenta,Doodle Kids Girls Party Frock Purple Dress,18166.jpg
2744,2,Girls,19,Tops,18,Orange,Disney Kids Girl's Orange Stripe Kidswear,2744.jpg
34155,2,Girls,19,Tops,13,Magenta,Gini and Jony Girls Pink Top,34155.jpg
38330,2,Girls,19,Tops,28,Yellow,Hannah Montana Girls Yellow Printed Tops,38330.jpg
4216,2,Girls,20,Tshirts,28,Yellow,Disney Kids Girl's Yellow Fun In The Fair Kidswear,4216.jpg
41757,2,Girls,19,Tops,28,Yellow,Doodle Girls Printed Yellow Top,41757.jpg
34152,2,Girls,19,Tops,3,Blue,Gini and Jony Girls Blue Top,34152.jpg
16805,2,Girls,16,Skirts,2,Black,ANT Kids Girls Printed Black Skirt,16805.jpg
18168,2,Girls,6,Dresses,20,Pink,Doodle Kids Girls Party Frock Pink Dress,18168.jpg
43694,2,Girls,6,Dresses,15,Navy Blue,Doodle Girls Navy Blue Dress,43694.jpg
8419,2,Girls,20,Tshirts,3,Blue,Doodle Girl's Crazy Funny Blue Teen Kidswear,8419.jpg
34164,2,Girls,19,Tops,22,Red,Gini and Jony Girls Red Top,34164.jpg
41759,2,Girls,6,Dresses,15,Navy Blue,Doodle Girls Navy Blue Dress,41759.jpg
4218,2,Girls,20,Tshirts,21,Purple,Disney Kids Girl's Purple Disney Jeans Kidswear,4218.jpg
34163,2,Girls,19,Tops,27,White,Gini and Jony Girls White Top,34163.jpg
41302,2,Girls,6,Dresses,20,Pink,Gini and Jony Girls Blue Saloppette,41302.jpg
